https://www.twisata.com/candi-hindu-prambanan-sejarah-keindahan-masa-lampau/,Candi Prambanan Sejarah Kejayaan Hindu Masa Lampau - | Twisata,Berikut ini ulasan mengenai Candi Prambanan yang ada di Yogyakarta merupakan peninggalan sejarah kejayaan Hindu dimasa lampau,candi
https://visitingjogja.com/12811/sendratari-ramayana-prambanan/,Sendratari Ramayana Prambanan - Dinas Pariwisata Daerah Istimewa Yogyakarta,"Di Candi Prambanan, pertunjukan tari ini dikenal dengan Sendratari Ramayana atau Ramayana Ballet. Sensasi yang didapatkan saat menonton pertunjukan sendratari Ramayana di Prambanan dan di tempat lainnya tentu berbeda. Ramayana Ballet Prambanan dilakukan dengan menjadikan Candi Prambanan sebagai latar pertunjukan.",candi
https://visitingjogja.com/12787/candi-ijo/,Candi Ijo Disebut juga sebagai Candi Tertinggi di Yogyakarta,"Candi Ijo merupakan candi tertinggi yang ada di Yogyakarta. Nama Candi Ijo sendiri diambil dari lokasi candi berada, yaitu Bukit Ijo yang terletak di Desa Sambirejo, Prambanan, Sleman, Yogyakarta. Bukit Ijo sendiri berada di ketinggian 410 mdpl",candi
https://visitingjogja.com/9162/candi-banyunibo/,"Candi Banyunibo, Belum Banyak Diketahui oleh Orang","Namanya Candi Banyunibo, lokasinya tidak jauh dari Candi Ijo dan Ratu Boko. Jadi jangan lupa mampir ke Banyunibo ya kalau pas main di daerah sana.",candi
https://visitingjogja.com/8348/candi-prambanan-eksotisnya-candi-hindu-di-yogyakarta/,"Candi Prambanan, Eksotisnya Candi Hindu di Yogyakarta",Prambanan adalah salah satu kompleks candi terbesar di Asia Tenggara yang kaya dengan arca dan relief. Kompleks candi ini terletak di Desa Prambanan dan secara administratif masuk dalam dua kabupaten dan dua provinsi sekaligus.,candi
https://visitingjogja.com/8273/candi-ratu-boko/,Candi Ratu Boko Bukti Toleransi Bragama pada Masanya,"Candi Ratu Boko terletak di kecamatan Bokoharjo, kabupaten Sleman. Luasnya yang mencapai 16 ha. membuat wilayah Ratu Boko masuk dalam dua desa, Dawung dan Sambirejo. Lokasinya kurang-lebih 17 km di sebelah timur kota Jogja dan dapat diakses lewat jalan raya Yogyakarta-Solo.",candi
https://visitingjogja.com/8270/candi-morangan-ngaglik-sleman/,Candi Morangan Ngaglik Sleman - Dinas Pariwisata Daerah Istimewa Yogyakarta,"Candi Morangan, salah satu candi Hindhu Kuno yang berlokasi di dusun Morangan, Sindumartani, Ngaglik, Sleman DIY. Candi ini merupakan candi hindhu yang tersebar di Kabupaten Sleman.",candi
https://visitingjogja.com/8267/candi-sewu/,Candi Sewu - Dinas Pariwisata Daerah Istimewa Yogyakarta,Candi Sewu adalah candi Buddha yang dibangun pada abad ke-8 yang berjarak hanya delapan ratus meter di sebelah utara Candi Prambanan. Candi Sewu merupakan kompleks candi Buddha terbesar kedua setelah Candi Borobudur di Jawa Tengah. Candi Sewu berusia lebih tua daripada Candi Prambanan.,candi
https://visitingjogja.com/8264/candi-sojiwan-kecamatan-prambanan/,Candi Sojiwan Kecamatan Prambanan - Dinas Pariwisata Daerah Istimewa Yogyakarta,Candi Sojiwan berada di sebuah area terbuka yang panjang halamannya lebih dari 100 m. Ciri khas candi ini adalah adanya sekitar 20 relief di kaki candi yang berhubungan dengan cerita-cerita Pancatantra atau Jataka dari India.,candi
https://www.nativeindonesia.com/candi-jiwa-karawang/,"Candi Jiwa Karawang, Candi Tertua Di Indonesia Dari Abad Ke-10","Candi Jiwa Karawang merupakan bagian dari kompleks Batujaya. Candi-candi itu diyakini tertua di Indonesia, lebih tua dari Candi Gedong Songo di Semarang.",candi
https://www.nativeindonesia.com/goa-gajah/,"Goa Gajah, Situs Kuno Bersejarah Di Bali Yang Masih Hidup",Goa gajah masuk dalam kategori ini.  Sebuah situs candi kuno yang didirikan lebih dari 1000 tahun lalu dan berfungsi sebagai tempat suci umat Hindu dan Budha.,candi
https://www.nativeindonesia.com/candi-borobudur/,"Candi Borobudur, Sejarah Dan Daya Tarik Wisata Yang Eksotis","Sejarah candi Borobudur, daya tarik wisata, harga tiket masuk, dan aktifitas yang bisa dilakukan di Borobudur. Baca DISINI selengkapnya...",candi
https://www.nativeindonesia.com/candi-prambanan/,"Candi Prambanan, Kisah Mahar Yang Tidak Terselesaikan",Candi Prambanan adalah salah satu kompleks candi yang terkenal di Indonesia dan ditetapkan UNESCO sebagai situs warisan dunia pada tahun 1991 selain Candi,candi
https://www.nativeindonesia.com/candi-sewu/,"Candi Sewu, Pelajaran Toleransi Dari Masa Lampau",Candi Sewu adalah salah satu dari puluhan candi di area itu. Kompleks Candi Sewu merupakan kumpulan candi Buddha terbesar di kawasan sekitar Candi Prambanan.,candi
https://mytrip123.com/candi-gedong-songo/,Candi Gedong Songo Peninggalan Sejarah Indah di Semarang,Candi gedong songo tempat wisata gedong songo di Bandungan Semarang Jawa Tengah tiket masuk ke kawasan wisata candi gedong songo,candi
https://eksotisjogja.com/wisata-candi-mendut-magelang-napak-tilas-budaya-masa-lampau/,10 Wisata Sekitar Candi Mendut yang Lagi Hits dan Populer 2017,Candi Mendut adalah salah satu candi peninggalan agama Buddha yang ada di Indonesia yang dibangun pada masa kerajaan Wangsa Syailendra,candi
https://eksotisjogja.com/candi-ratu-boko-jogja/,15 Wisata Sekitar Candi Ratu Boko yang Lagi Hits 2019 - Sunset di Candi Ratu Boko Jogja,"Berdasarkan struktur bangunan dan prasasti yang ditemukan, kompleks Ratu Boko awalnya adalah sebuah wihara untuk pendeta Buddha yang bernama Abhayagiri.",candi
https://eksotisjogja.com/sundet-candi-ijo-jogjakarta/,10 Spot Foto di Candi Ijo Jogja yang Lagi Hits 2017 - Spot Sunset di Jogja,"Candi Ijo Kalasan adalah sebuah candi yang letaknya berada di atas Bukit Ijo, nama candi ini di ambil dari nama tempat dimana lokasi candi tersebut.",candi
https://eksotisjogja.com/eksotisme-senja-candi-barong-teras-ketiga/,Eksotisme Senja di Candi Barong Dari Teras Ketiga - Eksotis Jogja,"Candi Barong ini adalah candi peninggalan Hindu yang berlokasi tidak jauh dari Istana Ratu Boko, tepatnya di Dusun Candisari, Kelurahan Bokoharjo.",candi
https://eksotisjogja.com/candi-sambisari/,10 Spot Foto Bagus di Candi Sambisari yang Lagi Hits 2019 - Wisata Candi,Candi Sambisar dibangun sekitar pada abad ke-10. Itu dibangun oleh dinasti Syailendra tepatnya pada masa pemerintahan Rakai Garung .,candi
https://eksotisjogja.com/candi-sari-jogja/,10 Spot Foto Keren di Candi Sari Yogyakarta yang Lagi Hits 2017,Candi Sari ini diketahui memiliki hubungan dengan Candi Kalasan sebagaimana yang tercantum dalam prasasti Kalasan tertulilis pada tahun 778 Masehi.,candi
https://eksotisjogja.com/tag/candi-di-jogja/,8 Tempat Wisata Candi di Jogja yang Wajib di Kunjungi | Eksotis jogja,"Ada banyak Candi peninggal kerajaan di kota Yogyakarta, Inilah Objek Wisata Museum di Jogja yang Wajib di Kunjungi saat berkunjung di kota jogja",candi
https://eksotisjogja.com/obyek-wisata-candi-prambanan-yogyakarta/,20 Wisata Sekitar Candi Prambanan yang Lagi Hits 2019 - Eksotisjogja.com,Candi Prambanan merupakan salah satu ikon Kota Yogyakarta yang menjadi tujuan utama oleh para wisatawan baik lokal maupun domestik.,candi
https://anekatempatwisata.com/wisata-indonesia-candi-borobudur/,Wisata Indonesia - Candi Borobudur - Aneka Tempat Wisata,Candi Borobudur adalah sebuah situs warisan dunia yang berlokasi di Indonesia dan merupakan salah satu tempat wisata yang paling terkenal di Indonesia,candi
https://anekatempatwisata.com/wisata-jogja-candi-prambanan/,Candi Prambanan - Wisata Bersejarah di Yogyakarta yang wajib dikunjungi,Candi Prambanan adalah salah satu kompleks candi yang terkenal di Indonesia dan ditetapkan UNESCO sebagai situs warisan dunia pada tahun 1991.,candi
https://pesona.travel/keajaiban/6033/kompleks-candi-gedong-songo-wisata-penuh-sejarah-dan-misteri,Kompleks Candi Gedong Songo Wisata Penuh Sejarah dan Misteri - Pesona Indonesia,"Wilayah Kabupaten Semarang merupakan daerah yang terdiri dari dataran tinggi. Salah satu tempat yang terkenal dan favorit di daerah tersebut adalah Bandungan, di lereng gunung Ungaran. Candi Gedong Songo salah satunya.",candi
