https://visitingjogja.com/12712/kebun-teh-nglinggo/,Kebun Teh Nglinggo Terletak di Kabupaten Kulon Progo,"Untuk mendapatkan suasana udara segar serta dingin cukup mengunjungi Kebun Teh Nglinggo yang berlokasi di Desa Ngargosari dan Desa Pagerharjo Kecamatan Samigaluh Kulon Progo, Yogyakarta.",kebun
https://visitingjogja.com/270/kebun-buah-mangunan/,Kebun Buah Mangunan - Dinas Pariwisata Daerah Istimewa Yogyakarta,"Ingin menikmati wisata kabut di Jogja? Yap! Datang saja ke kebun buah mangunan bantul. Apabila beruntung, dipagi hari akan menemukan lautan kabut di puncak.",kebun
https://www.water-sport-bali.com/kebun-strawberry-bedugul/,Kebun Strawberry Bedugul - Wisata Metik Buah Stroberi Untuk Milkshake,"Bali Strawberry Farm Restaurant Bedugul, menyediakan layanan memetik buah stroberi langsung dari kebun dan menikmati buah strawberry segar.",kebun
https://www.nativeindonesia.com/wayang-windu-panenjoan/,"Wayang Windu Panenjoan, Keindahan Di Sejuknya Dataran Tinggi Bandung",Wayang Windu Panenjoan indah dengan perkebunan teh yang adem dan menyejukan mata. Berpadu birunya langit menambah pesona anggunnya pemandangan di WWP 1800 ini.,kebun
https://www.nativeindonesia.com/kebun-teh-sukawana/,"✔ Segarnya Kebun Teh Sukawana Di Lembang, Ga Jauh Dari Bandung!","Kebun teh Sukawana di Parongpong adalah salah satu kebun teh di Lembang yg indah sekali. Info lengkap alamat kebun teh sukawana, peta menuju lokasi, foto dan lainnya silahkan lihat disini ya!",kebun
https://www.nativeindonesia.com/kebun-raya-bogor/,"Kebun Raya Bogor, Wisata Edukasi, Selfi, Hingga Misteri Ada Di Sini","Siapa yang tidak tahu Kebun Raya Bogor, keindahan kawasan yang berpadu dengan sejarah ini memang memiliki pesona magis tersendiri.",kebun
https://www.nativeindonesia.com/kebun-raya-bedugul/,"Kebun Raya Bedugul, Tempat Belajar Dan Berselfie Bersama Flora","Saat ini kita tidak akan menjelajah kebun raya ini. melainkan, Kebun Raya Bali. Atau yang dikenal dengan Kebun Raya Bedugul. Kawasan ini hampir mirip dengan",kebun
https://www.nativeindonesia.com/kebun-buah-mangunan/,"Kebun Buah Mangunan Jogja, Pesona Indah Di Atas Awan","jangan lewatkan Spot fotogenic dan indah di Jogja ini! Lihat review kebun buah Mangunan, harga tiket, fasilitas, dan juga cara menuju lokasi lengkap di sini.",kebun
https://www.nativeindonesia.com/kebun-teh-pagilaran/,"Kebun Teh Pagilaran, Tetap Berjaya Sejak Didirikan 130 Tahun Lalu",Kebun Teh Pagilaran Batang menyajikan hamparan hijau tanaman teh di antara bukit-bukit yang berkelok. Memberikan pemandangan yang indah dan memanjakan mata.,kebun
https://www.nativeindonesia.com/batu-secret-zoo/,"Batu Secret Zoo, Kebun Binatang Modern Dengan 10 Area Cantik","Batu Secret Zoo merupakan tempat wisata dan kebun binatang modern yang terletak di Kota Batu, Jawa Timur. Batu Secret Zoo yang berada di tanah seluas 14 hektar.",kebun
https://www.nativeindonesia.com/kebun-mawar-situhapa-garut/,Kebun Mawar Situhapa Garut Yang Cantik,Kebun mawar situhapa garut menawarkan pemandangan kebun mawar nan indah dan tempat menginap yang unik. terletak dekat dengan kampung sampireun Garut,kebun
https://mytrip123.com/kebun-strawberry-ciwidey/,7 Spot Foto Kebun Strawberry Ciwidey - Harga Tiket - 2020 #1,Berikut spot foto terbaru di kabun buah strawberry ciwidey bandung yang masih jarang diketahuai oleh wisatawan. Dengan harga tiket masuk yang terjangkau,kebun
https://mytrip123.com/kebun-teh-rancabali/,8 Spot Foto Kebun Teh Rancabali Ciwidey - Harga Tiket - 2020 #1,Berikut rekomendasi spot foto hits di kebun teh rancabali ciwidey bandung yang sangat indah. Simak juga harga tiket masuk terbaru dan rute menuju lokasi,kebun
https://eksotisjogja.com/negeri-di-atas-awan-kebun-buah-mangunan-yogyakarta/,10 Spot Foto Keren di Kebun Buah Mangunan yang Lagi Hits 2019 - Pesona Negeri Diatas Awan Jogja,"Negeri di atas awan, begitulah julukan buntuk tempat wisata Taman Buah Mangunan yang ada di kabupaten Bantul, Yogyakarta.",kebun
https://eksotisjogja.com/wisata-kebun-teh-nglinggo-bukit-menoreh/,"Kebun Teh Nglinggo, Inilah Satu Satunya Kebun Teh di Jogja - Eksotis Jogja","wisata kebun teh nglinggo terletak di perbukitan menoreh, tepatnya di desa wisata nglinggo Pagerharjo, Samigaluh, Kabupaten Kulon Progo, Yogyakarta",kebun
https://eksotisjogja.com/kebun-binatang-gembira-loka-jogja/,12 Spot Foto di Kebun Binatang Gembira Loka Jogja yang Hits 2017,"Wisata kebun binatang ini tidak hanya untuk koleksi satwa, akan tetapi terdapat juga wahana permainan dan juga taman untuk bersantai.",kebun
