https://pesona.travel/keajaiban/3894/berkunjung-ke-pulau-penyengat-kepulauan-riau-ini-jalurnya,"Berkunjung ke Pulau Penyengat, Kepulauan Riau, Ini Jalurnya - Pesona Indonesia","Pulau di muara Sungai Riau, Pulau Bintan ini selama berabad-abad dikenal oleh para pelaut karena menjadi tempat persinggahan untuk mengambil air tawar yang cukup banyak tersedia di Pulau Penyengat."
https://pesona.travel/destinasi/337/tanjungpinang-jalur-strategis-perdagangan-kesultanan-riau,"Tanjungpinang, Jalur Strategis Perdagangan Kesultanan Riau  - Pesona Indonesia","Ibu kota dari Provinsi Kepulauan Riau, terletak di Pulau Bintan, dikelilingi beberapa pulau kecil seperti Pulau Dompak dan Pulau Penyengat. Dahulu adalah pusat pemerintahan Kesultanan Riau-Lingga. Kini Tanjungpinang tetap memikat dengan berbagai destinasi"
https://pesona.travel/keajaiban/5698/pesona-lima-pulau-di-kepulauan-riau,Pesona Lima Pulau di Kepulauan Riau - Pesona Indonesia,Kepulauan Riau merupakan bukti lain betapa kaya dan indahnya bumi Indonesia. Bentangan alam yang menakjubkan tersaji di kepulauan ini. 
https://pesona.travel/keajaiban/4802/susur-pantai-bintan-panorama-indah-dan-fasilitas-lengkap,"Susur Pantai Bintan, Panorama Indah dan Fasilitas Lengkap - Pesona Indonesia","Selesai di Lagoi, hari berikutnya perjalanan berlanjut ke Pantai Trikora. Jalan menuju pantai ini sepi. Sebenarnya antara Pantai Trikora dan Lagoi adalah bibir laut yang tak terputus. Tapi perbukitan dan resor menjadi pemisah dua kawasan wisata ini. Sebel"
https://pesona.travel/keajaiban/4667/menelusuri-keindahan-pantai-tanjung-momong,Menelusuri Keindahan Pantai Tanjung Momong - Pesona Indonesia,"Cara terbaik mengunjungi  Pantai Tanjung Momong adalah dengan naik sepeda motor, meski via laut pun sebenarnya bisa juga dilakukan. Waktu tempuh dari kawasan kota ke lokasi pantai berkisar 15 menit. Kalau hendak ke sana, Sobat Pesona harus melintasi jalan"
https://pesona.travel/destinasi/2563/5-destinasi-liburan-eksotik-di-tanjungpinang,5 Destinasi Liburan Eksotik di Tanjungpinang - Pesona Indonesia,"Menghabiskan akhir minggu atau long weekend di Tanjungpinang? Jangan khawatir! Ibu kota Kepulauan Riau ini bakal memberi pengalaman yang istimewa. Tanjungounang menawarkan cukup banyak wisata alam hingga budaya yang luar biasa, paduan antara alam, tradisi"
https://pesona.travel/destinasi/1229/pulau-natuna-pantai-indah-dan-taj-mahal,"Pulau Natuna, Pantai Indah dan Taj Mahal - Pesona Indonesia","Pulau Natuna termasuk ke dalam area provinsi Kepulauan Riau, yang memiliki pusat administrasi di Kota Ranai. Nama Natuna diambil dari bahasa belanda yaitu Natunae, yang berarti alami. Tak heran jika Pulau Natuna memiliki gugusan pemandangan alam yang sang"
https://pesona.travel/destinasi/857/batam-beranda-singapura-yang-menyajikan-kuliner-menakjubkan,Batam Beranda Singapura yang Menyajikan Kuliner Menakjubkan - Pesona Indonesia,"Dari Bintan ke Batam kurang dari satu jam dengan feri, satu feri berangkat setiap 15 menit dari Pelabuhan Seri Bintan Pura ke Pelabuhan Telaga Punggur. Tinggal di sebuah hotel di pusat bisnis pusat kota Nagoya, saya segera merasa bahwa satu kaki sudah ber"
https://pesona.travel/profile-editor-tamu/45/list,"Hari ""Anak Dolan"" - Editor Petualangan - Pesona Indonesia","Pesona Indonesia menyajikan informasi tentang destinasi wisata, festival mislanya krakatau yang tersebar dari seluruh pelosok nusantara ini untuk Anda dan semua yang akan melakukan perjalanan baik di bulan Agustus atau kapanpun"
https://pesona.travel/profile-editor-tamu/44/list,Azcha Tobing - Editor Alam - Pesona Indonesia,"Pesona Indonesia menyajikan informasi tentang destinasi wisata, festival mislanya krakatau yang tersebar dari seluruh pelosok nusantara ini untuk Anda dan semua yang akan melakukan perjalanan baik di bulan Agustus atau kapanpun"
https://pesona.travel/profile-editor-tamu/41/list,Yulianus Ladung - Editor Alam - Pesona Indonesia,"Pesona Indonesia menyajikan informasi tentang destinasi wisata, festival mislanya krakatau yang tersebar dari seluruh pelosok nusantara ini untuk Anda dan semua yang akan melakukan perjalanan baik di bulan Agustus atau kapanpun"
https://pesona.travel/profile-editor-tamu/40/list,Heret Frasthio - Editor Petualangan - Pesona Indonesia,"Pesona Indonesia menyajikan informasi tentang destinasi wisata, festival mislanya krakatau yang tersebar dari seluruh pelosok nusantara ini untuk Anda dan semua yang akan melakukan perjalanan baik di bulan Agustus atau kapanpun"
https://pesona.travel/profile-editor-tamu/38/list,Taufan Wijaya - Editor Alam - Pesona Indonesia,"Pesona Indonesia menyajikan informasi tentang destinasi wisata, festival mislanya krakatau yang tersebar dari seluruh pelosok nusantara ini untuk Anda dan semua yang akan melakukan perjalanan baik di bulan Agustus atau kapanpun"
https://pesona.travel/profile-editor-tamu/37/list,Yuki Anggia - Editor Alam - Pesona Indonesia,"Pesona Indonesia menyajikan informasi tentang destinasi wisata, festival mislanya krakatau yang tersebar dari seluruh pelosok nusantara ini untuk Anda dan semua yang akan melakukan perjalanan baik di bulan Agustus atau kapanpun"
https://pesona.travel/profile-editor-tamu/35/list,"Ari ""Amphibia"" - Editor Alam - Pesona Indonesia","Pesona Indonesia menyajikan informasi tentang destinasi wisata, festival mislanya krakatau yang tersebar dari seluruh pelosok nusantara ini untuk Anda dan semua yang akan melakukan perjalanan baik di bulan Agustus atau kapanpun"
https://pesona.travel/profile-editor-tamu/34/list,Pinneng - Editor Petualangan - Pesona Indonesia,"Pesona Indonesia menyajikan informasi tentang destinasi wisata, festival mislanya krakatau yang tersebar dari seluruh pelosok nusantara ini untuk Anda dan semua yang akan melakukan perjalanan baik di bulan Agustus atau kapanpun"
https://pesona.travel/profile-editor-tamu/33/list,Misbachul Munir - Editor Alam - Pesona Indonesia,"Pesona Indonesia menyajikan informasi tentang destinasi wisata, festival mislanya krakatau yang tersebar dari seluruh pelosok nusantara ini untuk Anda dan semua yang akan melakukan perjalanan baik di bulan Agustus atau kapanpun"
https://pesona.travel/profile-editor-tamu/30/list,Rohani Tanasal - Editor Alam - Pesona Indonesia,"Pesona Indonesia menyajikan informasi tentang destinasi wisata, festival mislanya krakatau yang tersebar dari seluruh pelosok nusantara ini untuk Anda dan semua yang akan melakukan perjalanan baik di bulan Agustus atau kapanpun"
https://pesona.travel/profile-editor-tamu/29/list,Annisa Malati - Editor Alam - Pesona Indonesia,"Pesona Indonesia menyajikan informasi tentang destinasi wisata, festival mislanya krakatau yang tersebar dari seluruh pelosok nusantara ini untuk Anda dan semua yang akan melakukan perjalanan baik di bulan Agustus atau kapanpun"
https://pesona.travel/profile-editor-tamu/28/list,Kevin Hendrawan - Editor Alam - Pesona Indonesia,"Pesona Indonesia menyajikan informasi tentang destinasi wisata, festival mislanya krakatau yang tersebar dari seluruh pelosok nusantara ini untuk Anda dan semua yang akan melakukan perjalanan baik di bulan Agustus atau kapanpun"
https://pesona.travel/profile-editor-tamu/27/list,Cia Wardhana - Editor Rekreasi - Pesona Indonesia,"Pesona Indonesia menyajikan informasi tentang destinasi wisata, festival mislanya krakatau yang tersebar dari seluruh pelosok nusantara ini untuk Anda dan semua yang akan melakukan perjalanan baik di bulan Agustus atau kapanpun"
https://pesona.travel/profile-editor-tamu/26/list,Ingga Suwanda - Editor Alam - Pesona Indonesia,"Pesona Indonesia menyajikan informasi tentang destinasi wisata, festival mislanya krakatau yang tersebar dari seluruh pelosok nusantara ini untuk Anda dan semua yang akan melakukan perjalanan baik di bulan Agustus atau kapanpun"
https://pesona.travel/profile-editor-tamu/25/list,Jovita Ayu - Editor Alam - Pesona Indonesia,"Pesona Indonesia menyajikan informasi tentang destinasi wisata, festival mislanya krakatau yang tersebar dari seluruh pelosok nusantara ini untuk Anda dan semua yang akan melakukan perjalanan baik di bulan Agustus atau kapanpun"
https://pesona.travel/profile-editor-tamu/24/list,Ade Putri - Editor Kuliner - Pesona Indonesia,"Pesona Indonesia menyajikan informasi tentang destinasi wisata, festival mislanya krakatau yang tersebar dari seluruh pelosok nusantara ini untuk Anda dan semua yang akan melakukan perjalanan baik di bulan Agustus atau kapanpun"
https://pesona.travel/profile-editor-tamu/21/list,Mila Haniva - Editor Alam - Pesona Indonesia,"Pesona Indonesia menyajikan informasi tentang destinasi wisata, festival mislanya krakatau yang tersebar dari seluruh pelosok nusantara ini untuk Anda dan semua yang akan melakukan perjalanan baik di bulan Agustus atau kapanpun"
https://pesona.travel/profile-editor-tamu/19/list,Arbain Rambey - Editor Alam - Pesona Indonesia,"Pesona Indonesia menyajikan informasi tentang destinasi wisata, festival mislanya krakatau yang tersebar dari seluruh pelosok nusantara ini untuk Anda dan semua yang akan melakukan perjalanan baik di bulan Agustus atau kapanpun"
https://pesona.travel/profile-editor-tamu/18/list,Sinta Ridwan - Editor Budaya - Pesona Indonesia,"Pesona Indonesia menyajikan informasi tentang destinasi wisata, festival mislanya krakatau yang tersebar dari seluruh pelosok nusantara ini untuk Anda dan semua yang akan melakukan perjalanan baik di bulan Agustus atau kapanpun"
https://pesona.travel/profile-editor-tamu/17/list,Asteriska - Editor Budaya - Pesona Indonesia,"Pesona Indonesia menyajikan informasi tentang destinasi wisata, festival mislanya krakatau yang tersebar dari seluruh pelosok nusantara ini untuk Anda dan semua yang akan melakukan perjalanan baik di bulan Agustus atau kapanpun"
https://pesona.travel/profile-editor-tamu/16/list,Don Hasman - Editor Petualangan - Pesona Indonesia,"Pesona Indonesia menyajikan informasi tentang destinasi wisata, festival mislanya krakatau yang tersebar dari seluruh pelosok nusantara ini untuk Anda dan semua yang akan melakukan perjalanan baik di bulan Agustus atau kapanpun"
https://pesona.travel/profile-editor-tamu/15/list,Gathot Subroto - Editor Kuliner - Pesona Indonesia,"Pesona Indonesia menyajikan informasi tentang destinasi wisata, festival mislanya krakatau yang tersebar dari seluruh pelosok nusantara ini untuk Anda dan semua yang akan melakukan perjalanan baik di bulan Agustus atau kapanpun"
https://pesona.travel/profile-editor-tamu/14/list,Bima Prasena - Editor Petualangan - Pesona Indonesia,"Pesona Indonesia menyajikan informasi tentang destinasi wisata, festival mislanya krakatau yang tersebar dari seluruh pelosok nusantara ini untuk Anda dan semua yang akan melakukan perjalanan baik di bulan Agustus atau kapanpun"
https://pesona.travel/destinasi/4369/pesona-alam-di-desa-jatiluwih-bali,Pesona Alam di Desa Jatiluwih Bali - Pesona Indonesia,"Memandang luas hamparan sawah berundak-undak yang indah, Desa Jatiluwih memberikan sensasi tenang ala pedesaan.
"
https://pesona.travel/destinasi/3196/badung-pusat-wisata-kelas-dunia,"Badung, Pusat Wisata Kelas Dunia - Pesona Indonesia","Kabupaten yang paling banyak dikunjungi oleh wisatawan. Wilayahnya mencakup Kuta, Nusa Dua, Canggu dan beberapa lokasi wisata kelas dunia, yang lebih dikenal dibanding kabupatennya."
https://pesona.travel/destinasi/983/denpasar-selain-pantai-ada-juga-wisata-sejarah-dan-religi,"Denpasar, Selain Pantai Ada Juga Wisata Sejarah dan Religi  - Pesona Indonesia","Berkunjung ke Kota Denpasar memang akan selalu membuat siapa saja tidak mau pulang. Betapa tidak, salah satu penggerak ekonomi terbesar di Denpasar adalah sektor pariwisatanya. Denpasar menyuguhkan objek wisata yang menarik dan sayang untuk dilewatkan. Ta"
https://pesona.travel/destinasi/1003/klungkung-memiliki-kejernihan-air-laut-seperti-kristal,"Klungkung, Memiliki Kejernihan Air Laut Seperti Kristal - Pesona Indonesia","Klungkung memiliki banyak destinasi wisata alam yang indah dan bisa diabadikan lewat foto. Meskipun Klungkung merupakan Kabupaten terkecil di Provinsi Bali, hanya memiliki luas wilayah sekitar 315 km persegi, namun Klungkung tetap memiliki spot wisata eks"
https://pesona.travel/keajaiban/5398/wisata-rasa-kuliner-tertua-jakarta-bagian-1,Wisata Rasa Kuliner Tertua Jakarta (Bagian 1)  - Pesona Indonesia,"Jika kalian mengunjungi saat hari libur, bersiap-siaplah untuk antre panjang. Belum lagi menanti bangku dan meja yang kosong. Saat terbaik untuk menikmati Ragusa adalah saat menjelang sore apalagi jika siang hari jakarta masih terasa panas-panasnya.  Sega"
https://pesona.travel/keajaiban/5384/catatan-kuliner-rembang-dapur-tradisional-yang-berjaya,"Catatan Kuliner Rembang, Dapur Tradisional yang Berjaya - Pesona Indonesia","Hien, sebuah restoran besar yang masih memasak dengan menggunakan tungku. Di zaman seperti ini, tentunya pelayanan sebuah gerai restoran haruslah cekatan jika tidak ingin ditinggal pelanggannya. Terkecuali sebuah restoran tua di Rembang itu. Restoran pera"
https://pesona.travel/keajaiban/5971/sehari-di-curug-putri-berasa-negeri-dongeng,Sehari di Curug Putri Berasa Negeri Dongeng - Pesona Indonesia,"Objek wisata ini, sesuai namanya Curug Putri, memang terlihat seperti seorang gadis cantik. Hal itulah yang menjadi alasan tempat ini dipanggil Curug Putri."
https://pesona.travel/keajaiban/5962/situ-gunung-indahnya-telaga-dan-hutan-di-sukabumi,"Situ Gunung, Indahnya Telaga dan Hutan di Sukabumi - Pesona Indonesia","Berada di ketinggian 850 mdpl, membuat Situ Gunung menjadi kawasan favorit untuk dikunjungi. Apalagi, pepohonan menjulang tinggi, sehingga menambah rasa nyaman dan menyenangkan. "
https://pesona.travel/destinasi/5395/kabupaten-majalengka-calon-daerah-modern-yang-dipercaya-sebagai-peristirahatan-terakhir-prabu-siliwangi,"Kabupaten Majalengka, Calon Daerah Modern yang Dipercaya Sebagai Peristirahatan Terakhir Prabu Siliwangi - Pesona Indonesia","Setelah rampungnya pembangunan Bandara Kertajati, nama Kabupaten Majalengka sontak menjadi pusat perhatian Indonesia. Namun, masih banyak orang di luar sana yang belum mengetahui seluk beluk dari kabupaten ini."
https://pesona.travel/destinasi/3610/tasikmalaya-mutiara-dari-priangan-timur-di-kaki-galunggung,"Tasikmalaya, Mutiara dari Priangan Timur di Kaki Galunggung - Pesona Indonesia","Sang Mutiara dari Priangan Timur itulah julukan bagi kota Tasikmalaya yang memang terkenal memiliki banyak spot wisata alam yang cantik, budaya dan tradisi masyarakat adat yang eksotik, hingga atmosfer religi yang kental. Mesti ada di lis kunjungan Sobat "
https://pesona.travel/destinasi/1025/linggarjati-kota-kecil-saksi-sejarah-islam-dan-kolonial,"Linggarjati, Kota Kecil Saksi Sejarah Islam dan Kolonial - Pesona Indonesia","Desa Linggajati terletak pada ketinggian 400 meter dari permukaan air laut. Desa ini mudah dijangkau, baik dari Kota Cirebon maupun Kota Kuningan. Jarak tempuh dari Kota Cirebon  sekitar 25 km dan jika dari Kota Kuningan sekitar 17 km. Desa ini sebelah se"
https://pesona.travel/destinasi/986/sukabumi-banyak-spot-foto-instagramable,"Sukabumi, Banyak Spot Foto Instagramable - Pesona Indonesia",Salah satu wilayah di Jawa Barat yang memiliki potensi wisata yang cukup beragam. Udara di sekitar yang sangat sejuk membuat siapa saja betah berada di Sukabumi. Hal ini dikarenakan wilayah Sukabumi yang dikelilingi oleh pegunungan. Sehingga tak heran jik
https://pesona.travel/keajaiban/5856/tugu-peringatan-gempa-ikon-kota-gunungsitoli,"Tugu Peringatan Gempa, Ikon Kota Gunungsitoli - Pesona Indonesia","Tugu yang cantik dan menyegarkan mata di tengah teriknya matahari di pulau kecil di tengah Samudera Indonesia ini. Tugu sarat makna ini mengingatkan kita tentang peristiwa gempa pada 2005, juga pengingat bagi warga Nias bahwa mereka tinggal di daerah rawa"
https://pesona.travel/keajaiban/5847/4-bukit-indah-pengawal-danau-toba, 4 Bukit Indah Pengawal Danau Toba - Pesona Indonesia,"Tujuan utama berwisata ke Danau Toba tentu adalah menikmati pesona danaunya. Namun , jangan kaget jika mendapat bonus pesona bukit-bukit indah di sekitarnya!"
https://pesona.travel/keajaiban/5838/peninggalan-bangsawan-nias-situs-batu-megalitik-hiligoe,"Peninggalan Bangsawan Nias, Situs Batu Megalitik Hiligoe - Pesona Indonesia","Batu megalitik ini kokoh berdiri, di samping prasasti bertuliskan tahun 1778. Di bagian bawah patung, ada simbol unik, bentuk penis yang sedang ereksi. Bentuk penis memang sengaja ditonjolkan sebagai makna kebangsawan Nias yang maskulin dan perkasa."
https://pesona.travel/destinasi/6072/gunungsitoli-sisi-lain-kota-tertua-di-kepulauan-nias,"Gunungsitoli, Sisi Lain Kota Tertua di Kepulauan Nias - Pesona Indonesia",Salah satu hal unik dan menarik dari Gunungsitoli adalah rumah tradisionalnya. Rumah tradisional Nias sangat unik karena strukturnya tahan gempa dan dibangun tanpa menggunakan paku.
https://pesona.travel/destinasi/5046/tapanuli-utara-saksi-sejarah-perjuangan,Tapanuli Utara Saksi Sejarah Perjuangan - Pesona Indonesia,"Kabupaten Tanah Batak terdiri dari lima wilayah yaitu Silindung, Humbang, Toba, Samosir dan Dairi yang masing-masing dipimpin oleh seorang Demang."
https://pesona.travel/destinasi/4912/sipirok-yang-alami-dingin-dan-sunyi,"Sipirok yang Alami, Dingin dan Sunyi - Pesona Indonesia",Satu wilayah Tapanuli Selatan yang dijamin tidak akan mengecewakan dan mampu membuat ingin datang lagi.
https://pesona.travel/destinasi/4289/sehari-di-gunung-sitoli-nih-4-destinasi-eksotik-di-luaha,"Sehari di Gunung Sitoli? Nih, 4 Destinasi Eksotik di Luaha - Pesona Indonesia","Gunung Sitoli sering disebut dengan Luaha, terletak di muara sungai Nou, yang saat ini dikenal sebagai Pasar Gunung Sitoli. Bentang alam Gunung Sitoli berupa bukit-bukit sempit dengan ketinggian yang beragam. Cuma punya waktu sehari di Gunung Sitoli?"
https://pesona.travel/keajaiban/6044/pantai-pulau-merah-eksotisme-di-ujung-timur-jawa,"Pantai Pulau Merah, Eksotisme di Ujung Timur Jawa - Pesona Indonesia","Keindahan dan kebersihan Pantai Pulau Merah juga menjadi daya tarik tersendiri, terlebih Pantai Pulau Merah memiliki sebuah pulau bentuk unik, seperti gunung di atas pantai dan mempunyai ketinggian 200 meter."
https://pesona.travel/destinasi/4920/menjajal-tracking-perjalanan-ke-sumenep,Menjajal Tracking Perjalanan ke Sumenep - Pesona Indonesia,"Dibangun pada tahun 1781, keraton ini memiliki arsitektur unik perpaduan Eropa, Arab juga Cina."
https://pesona.travel/destinasi/3447/jember-kota-religi-dengan-ikon-fashion-dan-arsitektur-masjid,"Jember, Kota Religi Dengan Ikon Fashion dan Arsitektur Masjid - Pesona Indonesia","Kota religius dengan masjid ikonik yang dibangun di abad 18. Kini berkibar sebagai penghasil tembakau kelas dunia, karnaval fashion terbesar di Indonesia hingga pantai-pantai cantik."
https://pesona.travel/destinasi/985/situbondo-indahnya-savana-di-jawa-timur,"Situbondo, Indahnya Savana di Jawa Timur - Pesona Indonesia","Situbondo terletak di daerah pesisir utara Pulau Jawa. Situbondo terletak sangat strategis, karena berada di tengah jalur transportasi darat jalur Jawa-Bali, hal ini membuat kegiatan perekonomian penduduk di Situbondo sangat hidup aktif."
https://pesona.travel/destinasi/984/pacitan-kota-1001-gua-di-jawa-timur,"Pacitan, Kota 1.001 Gua di Jawa Timur - Pesona Indonesia","Pacitan, sebuah kota di Jawa Timur yang mendapat julukan sebagai kota 1.001 Gua. Karena memang ada banyak sekali gua di Pacitan. Hal ini pun yang menjadi daya tarik tersendiri bagi para wisatawan. Selain Gua dan Pantai, Pacitan juga memiliki potensi wisat"
https://pesona.travel/keajaiban/5399/pesona-danau-batur-kintamani-untuk-relaksasi,Pesona Danau Batur Kintamani untuk Relaksasi - Pesona Indonesia,"Tepat di sebelah dermaga penyebrangan, berdiri sebuah hotel dilengkapi restoran yang mengapung di atas Danau Batur, namanya Resto Apung. Di seputar resto, kita bisa saksikan keindahan Danau Batur dari sudut berbeda. Di sinilah, mungkin, kita bisa menata j"
https://pesona.travel/keajaiban/5373/kisah-benteng-marlborough-sejak-zaman-penjajahan-inggris,Kisah Benteng Marlborough Sejak Zaman Penjajahan Inggris - Pesona Indonesia,"Namun tahun 1949-1950, Benteng Marlborough diduduki kembali oleh Belanda. Setelah Belanda pergi barulah menjadi markas TNI-ADI hingga tahun 1977. Selanjutnya benteng diserahkan kepada pemerintah untuk dipugar dan dijadikan bangunan cagar budaya."
https://pesona.travel/keajaiban/5974/kebun-teh-gunung-dempo-yang-menyejukkan-mata,Kebun Teh Gunung Dempo yang Menyejukkan Mata - Pesona Indonesia,"Gunung Dempo mempunyai panorama alam yang sangat indah, dan akan terpesona dengan keasrian alamnya. Perjalanan akan dihiasi dengan pemandangan yang menakjubkan."
https://pesona.travel/keajaiban/5779/pesona-10-wisata-alam-di-palembang,Pesona 10 Wisata Alam di Palembang - Pesona Indonesia,"Selain memiliki pempek yang lezat, Palembang ternyata menyimpan banyak sekali destinasi alam yang sayang untuk dilewatkan."
https://pesona.travel/keajaiban/5653/lakuer-produk-khas-palembang-yang-mendunia,"Lakuer, Produk Khas Palembang yang Mendunia - Pesona Indonesia","Berbahan kayu lokal, lahirlah kerajinan lakuer khas Palembang yang kini diburu kolektor dunia."
https://pesona.travel/destinasi/4910/pagar-alam-wisata-lengkap-dengan-cuaca-sejuk,"Pagar Alam, Wisata Lengkap dengan Cuaca Sejuk - Pesona Indonesia",Kota kecil unik yang menawarkan wisata alam serta aneka peninggalan bersejarah.
https://pesona.travel/destinasi/2961/lubuk-linggau-kota-metropolitan-dengan-potensi-wisata-menarik,"Lubuk Linggau, Kota Metropolitan dengan Potensi Wisata Menarik - Pesona Indonesia","Lubuk Linggau merupakan salah satu kota yang cukup ramai di wilayah Sumatera Selatan. Kota ini terus berkembang mengikuti perubahan dan tantangan di yang datang. Kini, Lubuk Linggau hampir setara dengan Kota Metropolitan lainnya yang ada di daerah-daerah "
https://pesona.travel/destinasi/697/palembang-bumi-sriwijaya-nan-elok,"Palembang, Bumi Sriwijaya Nan Elok - Pesona Indonesia","Kota Palembang adalah ibu kota provinsi Sumatera Selatan, kota terbesar kedua di Sumatera setelah Medan. Kota Palembang memiliki luas wilayah 358,55 km persegi menjadi rumah bagi 1,8 juta warganya. Penduduk kota Palembang didominasi oleh etnis Melayu dan "
https://pesona.travel/keajaiban/5661/aneka-kopi-kaya-rasa-dari-pulau-sulawesi,Aneka Kopi Kaya Rasa dari Pulau Sulawesi - Pesona Indonesia,"Saat ini, minum kopi sudah menjadi gaya hidup, baik di kota maupun di desa. Indonesia sebagai salah satu negara pengekspor kopi terbesar di dunia memiliki banyak sekali jenis kopi. "
https://pesona.travel/keajaiban/5499/mengenal-kapal-tangguh-karya-nenek-moyang-kita-kapal-pinisi,"Mengenal Kapal Tangguh Karya Nenek Moyang Kita, Kapal Pinisi - Pesona Indonesia",Sulawesi membuktikan bahwa nenek moyang bangsa Indonesia memang seorang pelaut.
https://pesona.travel/destinasi/4430/jeneponto-magnet-wisata-dari-sulawesi-selatan,"Jeneponto, Magnet Wisata dari Sulawesi Selatan - Pesona Indonesia","Kabupaten Jeneponto berbatasan dengan Kabupaten Takalar dan Bantaeng. Sebagian daerahnya merupakan dataran tinggi dan sebagian lainnya pesisir pantai. Karakter inilah yang menjadikan Jeneponto sebagai salah satu tujuan wisata di Sulawesi Selatan.
"
