https://pesona.travel/,Pesona Indonesia,"Pesona Indonesia menyajikan informasi tentang destinasi wisata, festival mislanya krakatau yang tersebar dari seluruh pelosok nusantara ini untuk Anda dan semua yang akan melakukan perjalanan baik di bulan Agustus atau kapanpun"
https://pesona.travel/login,Pesona Indonesia,"Pesona Indonesia menyajikan informasi tentang destinasi wisata, festival mislanya krakatau yang tersebar dari seluruh pelosok nusantara ini untuk Anda dan semua yang akan melakukan perjalanan baik di bulan Agustus atau kapanpun"
https://pesona.travel/keajaiban,Keajaiban - Pesona Indonesia,"Pesona Indonesia menyajikan informasi tentang destinasi wisata, festival mislanya krakatau yang tersebar dari seluruh pelosok nusantara ini untuk Anda dan semua yang akan melakukan perjalanan baik di bulan Agustus atau kapanpun"
https://pesona.travel/wonders/petualangan,Petualangan - Pesona Indonesia,"Pesona Indonesia menyajikan informasi tentang destinasi wisata, festival mislanya krakatau yang tersebar dari seluruh pelosok nusantara ini untuk Anda dan semua yang akan melakukan perjalanan baik di bulan Agustus atau kapanpun"
https://pesona.travel/wonders/alam,Alam - Pesona Indonesia,"Pesona Indonesia menyajikan informasi tentang destinasi wisata, festival mislanya krakatau yang tersebar dari seluruh pelosok nusantara ini untuk Anda dan semua yang akan melakukan perjalanan baik di bulan Agustus atau kapanpun"
https://pesona.travel/wonders/budaya,Budaya - Pesona Indonesia,"Pesona Indonesia menyajikan informasi tentang destinasi wisata, festival mislanya krakatau yang tersebar dari seluruh pelosok nusantara ini untuk Anda dan semua yang akan melakukan perjalanan baik di bulan Agustus atau kapanpun"
https://pesona.travel/wonders/kuliner,Kuliner - Pesona Indonesia,"Pesona Indonesia menyajikan informasi tentang destinasi wisata, festival mislanya krakatau yang tersebar dari seluruh pelosok nusantara ini untuk Anda dan semua yang akan melakukan perjalanan baik di bulan Agustus atau kapanpun"
https://pesona.travel/wonders/rekreasi,Rekreasi - Pesona Indonesia,"Pesona Indonesia menyajikan informasi tentang destinasi wisata, festival mislanya krakatau yang tersebar dari seluruh pelosok nusantara ini untuk Anda dan semua yang akan melakukan perjalanan baik di bulan Agustus atau kapanpun"
https://pesona.travel/destinasi,Destinasi - Pesona Indonesia,"Pesona Indonesia menyajikan informasi tentang destinasi wisata, festival mislanya krakatau yang tersebar dari seluruh pelosok nusantara ini untuk Anda dan semua yang akan melakukan perjalanan baik di bulan Agustus atau kapanpun"
https://pesona.travel/agenda,Agenda - Pesona Indonesia,"Pesona Indonesia menyajikan informasi tentang destinasi wisata, festival mislanya krakatau yang tersebar dari seluruh pelosok nusantara ini untuk Anda dan semua yang akan melakukan perjalanan baik di bulan Agustus atau kapanpun"
https://pesona.travel/inspirasi,Inspirasi - Pesona Indonesia,"Pesona Indonesia menyajikan informasi tentang destinasi wisata, festival mislanya krakatau yang tersebar dari seluruh pelosok nusantara ini untuk Anda dan semua yang akan melakukan perjalanan baik di bulan Agustus atau kapanpun"
https://pesona.travel/bekal-pejalan,Bekal Pejalan - Pesona Indonesia,"Pesona Indonesia menyajikan informasi tentang destinasi wisata, festival mislanya krakatau yang tersebar dari seluruh pelosok nusantara ini untuk Anda dan semua yang akan melakukan perjalanan baik di bulan Agustus atau kapanpun"
https://pesona.travel/bekal-pejalan/6088/jalan-jalan-seru-tapi-tetap-di-rumah-aja-coba-yuk-sobat-pesona,"Jalan - Jalan Seru Tapi Tetap di Rumah Aja, Coba Yuk Sobat Pesona! - Pesona Indonesia","Kalau rindu sama hijaunya alam Indonesia, pantai dan juga tempat wisata Indonesia yang indah, Sobat Pesona bisa mencoba jalan-jalan online, nih. Walaupun jaga jarak, jalan-jalan keliling Indonesia bisa dilakukan di rumah aja. Cobain, deh pengalaman seru i"
https://pesona.travel/inspirasi/6084/festival-kuliner-hingga-fashion-carnival-di-festival-pesona-bau-nyale-2020,Festival Kuliner hingga Fashion Carnival di Festival Pesona Bau Nyale 2020 - Pesona Indonesia,"Apa itu Bau Nyale? Bau Nyale sendiri merupakan ritual tahunan menangkap Cacing Laut, yang menurut mitos adalah jelmaan Putri Mandalika. Konon, cacing laut (nyale) yang ditangkap saat Festival Pesona Bau Nyale merupakan jelmaan Putri Mandalika. "
https://pesona.travel/inspirasi/6082/kentalnya-budaya-melayu-di-festival-pesona-pulau-penyengat-2020,Kentalnya Budaya Melayu di Festival Pesona Pulau Penyengat 2020 - Pesona Indonesia,"Festival Pesona Pulau Penyengat 2020 akan resmi digelar 19-21 Maret 2020. Seharusnya, event tersebut digelar 14-18 Februari 2020. Venuenya tetap di Pulau Penyengat, Tanjungpinang, "
https://pesona.travel/editor-tamu,Editor Tamu - Pesona Indonesia,"Pesona Indonesia menyajikan informasi tentang destinasi wisata, festival mislanya krakatau yang tersebar dari seluruh pelosok nusantara ini untuk Anda dan semua yang akan melakukan perjalanan baik di bulan Agustus atau kapanpun"
https://pesona.travel/keajaiban/5608/nasi-campur-ayam-men-weti-rasa-yang-merindukan,"Nasi Campur Ayam Men Weti, Rasa yang Merindukan - Pesona Indonesia","Lalu, apakah semua itu akan bercampur dalam satu piring? Ya, dalam satu piring nanti akan ada nasi, sayur urap Bali (tauge, bayam, kacang panjang, pare, kangkung, dan daun gonda), ayam suwir bumbu betutu, telur bumbu tomat pedas, benyuh atau kelapa serut "
https://pesona.travel/profile-editor-tamu/22/list,Marrysa Tunjung Sari - Editor Alam - Pesona Indonesia,"Pesona Indonesia menyajikan informasi tentang destinasi wisata, festival mislanya krakatau yang tersebar dari seluruh pelosok nusantara ini untuk Anda dan semua yang akan melakukan perjalanan baik di bulan Agustus atau kapanpun"
https://pesona.travel/keajaiban/5606/bersantai-di-tengah-debur-air-terjun-pelangi,Bersantai di Tengah Debur Air Terjun Pelangi - Pesona Indonesia,Banyak pelancong datang ke sini melalui rute Lembang atau Cihideung. Air Terjun Pelangi berjarak kurang lebih 12 kilometer dari Alun-alun Cimahi dengan rute jalan menanjak dan waktu tempuh kira-kira 30 menit. Posisi air terjun berada di lembah di sebelah 
https://pesona.travel/profile-editor-tamu/23/list,Dudi Sugandi - Editor Rekreasi - Pesona Indonesia,"Pesona Indonesia menyajikan informasi tentang destinasi wisata, festival mislanya krakatau yang tersebar dari seluruh pelosok nusantara ini untuk Anda dan semua yang akan melakukan perjalanan baik di bulan Agustus atau kapanpun"
https://pesona.travel/keajaiban/5604/kuliner-unik-siantar-burung-goreng-sate-dan-martabak,"Kuliner Unik Siantar, Burung Goreng, Sate dan Martabak - Pesona Indonesia","Makan siang di Siantar, wajib mencicipi hidangan burung goreng yang ada di rumah makan Beringin Indah. Rumah makan yang sudah berdiri sejak tahun 1984 ini sejak awal hanya menyajikan menu burung goreng dan soto ayam dengan cita rasa khas Melayu-Jawa."
https://pesona.travel/keajaiban/5602/menikmati-surga-tersembunyi-curug-malela-yang-anggun,Menikmati Surga Tersembunyi Curug Malela yang Anggun - Pesona Indonesia,"Pesona Curug Malela terpancar lewat bentukan alami air terjun dan bebatuan di sekitarnya. Bukan satu, melainkan lima air terjun berdampingan dalam satu aliran air yang bikin takjub. Jika diperhatikan, seperti membentuk tirai putih berbahan sutra dan enak "
https://pesona.travel/keajaiban/5600/nasi-tempong-pedas-yang-menampar,"Nasi Tempong, Pedas yang “Menampar” - Pesona Indonesia","goreng dan kuah, telur pindang, ayam goreng, paru goreng, cumi hitam, ikan asin sepat, udang dan sebagainya. Jangan lupa untuk mencoba rajungan goreng. Rasanya renyah dan gurih. Santapan sederhana ini terasa sedap karena semuanya disajikan dalam keadaan h"
https://pesona.travel/keajaiban/5591/curug-batu-templek-tebing-batu-dan-air-terjun-eksotis,"Curug Batu Templek, Tebing Batu dan Air Terjun Eksotis - Pesona Indonesia","Air terjun yang berjatuhan dari tebing berasal dari Kali Cisanggarung yang mengalir di atasnya. Dari pintu air jembatan kali ini, masyarakat setempat memanfaatkan dan membagi air sungai tersebut untuk mengairi persawahan. Jika musim kemarau debit air yang"
https://pesona.travel/keajaiban/5589/tradisi-panjang-jimat-keraton-cirebon,Tradisi Panjang Jimat Keraton Cirebon - Pesona Indonesia,Jimat sendiri merupakan akronim dari kata “diaji” dan “dirumat” yang artinya ajaran-ajaran Islam dipelajari dan diamalkan dengan mencontoh Nabi Muhammad SAW. Sebuah pesan simbolik untuk mempertahankan tauhid sepanjang hayat.
https://pesona.travel/profile-editor-tamu/20/list,Ray Bachtiar - Editor Budaya - Pesona Indonesia,"Pesona Indonesia menyajikan informasi tentang destinasi wisata, festival mislanya krakatau yang tersebar dari seluruh pelosok nusantara ini untuk Anda dan semua yang akan melakukan perjalanan baik di bulan Agustus atau kapanpun"
https://pesona.travel/keajaiban/5588/kuliner-palembang-masa-kecil,Kuliner Palembang Masa Kecil - Pesona Indonesia,"Diakui oleh beberapa warga Palembang bahwa meskipun terlihat sederhana, ternyata mengolah pepes atau brengkes tempoyak dengan lauk lain tidak mudah. Pepes ikan yang sudah dilumuri bumbu tempoyak biasanya dibungkus dengan daun pisang lalu dikukus hingga ma"
https://pesona.travel/keajaiban/6068/3-lokasi-sunset-terbaik-di-malang,3 Lokasi Sunset Terbaik di Malang - Pesona Indonesia,"Wisata alam di Malang sangat beragam. Hal ini membuat kita ingin selalu kembali ke Kota Apel ini. Apalagi jika Sobat Pesona mengunjungi lokasi berikut untuk menyaksikan keindahan sunset, dijamin tak ingin pulang dan mungkin berpikiran untuk berdomisili di"
https://pesona.travel/keajaiban/2261/takabonerate-trip-another-beautiful-twilight-in-tinabo-kecil,Takabonerate Trip : Another Beautiful Twilight in Tinabo Kecil - Pesona Indonesia,"Ada Tinanja Besar, ada Tinanja Kecil. Ada Tinabo Besar, ada juga Tinabo Kecil. Begitu simple-nya orang-orang pulau di Taka Bonerate memberi nama pulau. Pemberian nama Besar atau Kecil didasarkan pada dua pulau yang berdampingan atau berhadapan. "
https://pesona.travel/keajaiban/5246/rafting-di-songa-menantang-nyali-dan-imajinasi,"Rafting di Songa, Menantang Nyali dan Imajinasi - Pesona Indonesia","Lebih dari 5 air terjun jatuh di dinding dengan ketinggain lebih dari 20m. lantas, para rafter melewatinya. Rasanya seperti petualangan di negeri dongeng."
https://pesona.travel/keajaiban/5218/misteri-dan-mitos-di-pantai-selatan-yang-bikin-penasaran-para-wisatawan,Misteri dan Mitos di Pantai Selatan yang Bikin Penasaran Para Wisatawan - Pesona Indonesia,"Di balik objek wisata yang ada di Yogyakarta, beberapa diantaranya berhubungan dengan mitos dan legenda. Contohnya Candi Borobudur yang konon dibangun dalam satu malam. Lalu mitos-mitos di Pantai Selatan. Apa saja mitos-mitos yang beredar di sekitar Panta"
https://pesona.travel/keajaiban/6078/5-wisata-alam-menarik-yang-harus-dikunjungi-di-jailolo,5 Wisata Alam Menarik yang Harus Dikunjungi di Jailolo - Pesona Indonesia,"Selain kaya akan buah, Jailolo juga memiliki banyak destinasi wisata seru yang bisa kita kunjungi ketika liburan tiba. Mulai dari keindahan pantainya, air terjun, hingga menikmati keindahan Jailolo dari ketinggian. Berikut ini adalah 5 wisata seru di Jail"
https://pesona.travel/keajaiban/3799/menikmati-keindahan-padang-selatan-dari-teluk-bayur,Menikmati Keindahan Padang Selatan dari Teluk Bayur - Pesona Indonesia,"Keindahan alam Indonesia memang tiada duanya, dengan kekayaan dan keragaman yang tersebar di seluruh nusantara. Dari berbagai ragam budaya dan objek wisata yang ada di nusantara, sudahkah Sobat Pesona mendengar atau berkunjung ke Teluk Bayur? "
https://pesona.travel/keajaiban/6034/air-terjun-segoro-gunung-20-meter-kesegaran-alami,"Air Terjun Segoro Gunung, 20 Meter Kesegaran Alami - Pesona Indonesia","Karanganyar merupakan salah satu Kabupaten yang terletak di lereng Gunung Lawu, tepatnya sebelah timur kota Solo. Di Kabupaten ini banyak terdapat air terjun. Salah satunya yang berada di desa Segoro Gunung."
https://pesona.travel/keajaiban/1815/danau-wakadobol-batujajar-airnya-berwarna-hijau,Danau Wakadobol Batujajar Airnya Berwarna Hijau - Pesona Indonesia,"Awalnya Danau Wakadobol hanya sebuah dataran yang kemudian dikeruk untuk diambil pasir dan batunya, lama-kelamaan lubang galian itu semakin besar dan terisi oleh air. Galian tersebut membentuk sebuah danau kecil yang warga sekitar menyebutnya sebagai Danau"
https://pesona.travel/keajaiban/6074/penjor-ornamen-istimewa-dan-agung-bagi-umat-hindu-di-bali,"Penjor, Ornamen Istimewa dan Agung bagi Umat Hindu di Bali - Pesona Indonesia","Selayaknya upacara agama lainnya, Hindu juga memiliki ornamen yang sangat melekat pada upacara Galungan, yakni penjor. Bukan sekadar ornamen, benda satu ini memiliki makna yang mendalam."
https://pesona.travel/keajaiban/2985/encim-dan-sadariah-pasangan-khas-betawi,"Encim dan Sadariah, Pasangan Khas Betawi - Pesona Indonesia","Seperti masyarakatnya yang majemuk, busana khas Betawi pun mendapat pengaruh budaya dari Cina, Arab, Melayu. Tak hanya kebaya encim dan baju koko, masyarakat Betawi memiliki 5 busana tradisional yang dikenakan sesuai kebutuhan dan suasana. Yuk, kenali bia"
https://pesona.travel/keajaiban/3719/peninggalan-bersejarah-negeri-laskar-pelangi,Peninggalan Bersejarah Negeri Laskar Pelangi - Pesona Indonesia,"Berkunjung ke Pulau Belitung wajib melihat benda-benda tradisional peninggalan Negeri Laskar Pelangi dari tempo dulu, coba berkunjung ke Museum Tanjung Pandan."
https://pesona.travel/keajaiban/2485/ragam-motif-dan-makna-kain-tenun-ikat-khas-flores,Ragam Motif dan Makna Kain Tenun Ikat Khas Flores - Pesona Indonesia,Setiap motif dalam kain tenun Flores punya makna yang berbeda. Beberapa motif di antaranya; motif belah ketupat yang menggambarkan persatuan antara pemerintah dan rakyat. Motif garis segitiga naik turun menggambarkan gunung yang mengapit Pulau Flores. Mot
https://pesona.travel/keajaiban/6002/mie-ongklok-longkrang-primadona-kuliner-khas-kabupaten-wonosobo,"Mie Ongklok Longkrang, Primadona Kuliner Khas Kabupaten Wonosobo - Pesona Indonesia","Menambah istimewa dari Mie Ongklok, yaitu disajikan dengan dilengkapi sate sapi dan tempe kemul khas Wonosobo sehingga semakin menggoda lidah."
https://pesona.travel/keajaiban/1023/kepiting-soka-lezatnya-kepiting-lunak-kalimantan,"Kepiting Soka, Lezatnya Kepiting Lunak Kalimantan - Pesona Indonesia","Sejatinya, kepiting soka tak ada bedanya dengan kepiting bakau lainnya. Yang membedakan adalah cara budidayanya yang perlu trik khusus. Untuk mendapatkan kepiting bercangkang lunak, petambak kepiting harus memelihara bibit kepiting di kolam budidaya selam"
https://pesona.travel/keajaiban/3549/soto-banjar-soto-bumbu-rempah-khas-kalimantan-selatan,"Soto Banjar, Soto Bumbu Rempah Khas Kalimantan Selatan - Pesona Indonesia","Ada kalanya pembuatan kuah soto banjar dapat dicampurkan dengan sedikit susu yang membuat warna kuahnya mejadi tidak bening, tetapi sedikit keruh. Soto banjar memakai bumbu rempah cengkih dan kapulaga yang tidak dihaluskan, hanya direbus dan diambil sarin"
https://pesona.travel/keajaiban/3272/mie-celor-mie-kuah-kaldu-udang-khas-palembang,"Mie Celor, Mie Kuah Kaldu Udang Khas Palembang - Pesona Indonesia","Meski tak bisa menyingkirkan keistimewaan pempek yang sudah begitu kenamaan, Bumi Sriwijaya ini masih punya suguhan kuliner khas yang tak kalah memikat dan patut diberi kesempatan untuk menggoyang lidah kita. Sajian itu dikenal sebagai Mie Celor."
https://pesona.travel/keajaiban/6077/beragam-wisata-seru-ada-di-kulon-progo,Beragam Wisata Seru Ada di Kulon Progo - Pesona Indonesia,"Kulon Progo bukan hanya sekadar kabupaten yang ada di Jogja. Faktanya, kabupaten ini menyimpan banyak destinasi wisata yang akan membuat kita betah berlama-lama di sana."
https://pesona.travel/keajaiban/5807/menggali-sejarah-di-kota-tua-pulau-jawa,Menggali Sejarah di Kota Tua Pulau Jawa - Pesona Indonesia,Kota tua seringkali jadi magnet bagi wisatawan. Ada banyak kota tua di Pulau Jawa yang layak kita telusuri.
https://pesona.travel/keajaiban/5013/wisata-boon-pring-serunya-wisata-alam-bernuansa-bambu,"Wisata Boon Pring, Serunya Wisata Alam Bernuansa Bambu - Pesona Indonesia","Hutan bambu seluas 25 hektar yang rimbun dan sejuk. Boon Pring dilengkapi dengan kolam renang buatan, lokasi yang instagrammable. Setidaknya, ada 25 varietas bambu di lahan wisata ini. Mulai jenis petung, apus, tutul, kuning, pagar, amplex dan banyak lagi"
https://pesona.travel/keajaiban/919/osing-deles-pusat-oleh-oleh-banyuwangi,"Osing Deles, Pusat Oleh-oleh Banyuwangi - Pesona Indonesia","Berdiri sejak tahun 2013 di Jajag, sebuah kota kecamatan di Gambiran, Banyuwangi. Awal mula Osing Deles adalah sebuah toko oleh2 kecil yang menyediakan kaos. Menggunakan nama Osing Deles yang artinya adalah Osing Banget, Burhanudin sang pemilik tidak ingi"
https://pesona.travel/rencanakan-perjalanan,Pesona Indonesia,"Pesona Indonesia menyajikan informasi tentang destinasi wisata, festival mislanya krakatau yang tersebar dari seluruh pelosok nusantara ini untuk Anda dan semua yang akan melakukan perjalanan baik di bulan Agustus atau kapanpun"
https://pesona.travel/page/syarat-ketentuan,Syarat & Ketentuan - Pesona Indonesia,Syarat & Ketentuan
https://pesona.travel/hubungi,Hubungi Kami - Pesona Indonesia,Hubungi Kami
https://pesona.travel/keajaiban/2247/meniti-danau-suci,Meniti Danau Suci - Pesona Indonesia,"Ranu Kumbolo adalah tempat menghela napas sebelum melanjutkan perjalanan ke Kalimati maupun ke puncak. Bahkan bagi sebagian pendaki, Ranu Kumbolo adalah tujuan akhir, mereka tak perlu mencapai puncak. Kita memang boleh camp di sini,  tetapi harus membawa "
https://pesona.travel/keajaiban/3285/berburu-air-suci-di-bromo-tengger-semeru,Berburu Air Suci di Bromo Tengger Semeru - Pesona Indonesia,"Air suci dari Gua Widodaren bukan sembarang air, melainkan air yang dipercaya memiliki khasiat membawa berkah. Sesuai kepercayaan, air di gua ini mampu melancarkan rezeki, jodoh, karir, dan sebagainya. Air ini termasuk air suci yang dipercaya oleh Suku Te"
https://pesona.travel/keajaiban/6019/spot-diving-dan-snorkeling-favorit-di-karimunjawa,Spot Diving dan Snorkeling Favorit di Karimunjawa - Pesona Indonesia,"Lokasinya memang agak jauh dari pulau Karimunjawa, namun semuanya akan terbayar ketika kita datang dan menikmati suasana keindahan bawah laut sekitar pulau cemara yang sunyi dan masih sangat asri."
https://pesona.travel/keajaiban/1214/yuk-eksplor-tiga-pantai-terindah-di-tanah-maluku-ini,"Yuk, Eksplor Tiga Pantai Terindah di Tanah Maluku Ini - Pesona Indonesia","Dengan luas lautan yang jauh lebih dominan ketimbang daratan, menjadikan Maluku sebagai salah satu provinsi yang unggul dengan deretan pantai dan lautnya yang indah memanjakan mata. Beberapa yang paling terkenal akan keindahan alamnya adalah Pantai Hatta,"
https://pesona.travel/keajaiban/5721/indahnya-lima-danau-di-sulawesi-utara,Indahnya Lima Danau di Sulawesi Utara - Pesona Indonesia,Wisata alam yang ada di Indonesia seolah tak pernah habis untuk diceritakan. Sulawesi Utara merupakan salah satu provinsi yang memiliki banyak tujuan wisata alam yang luar biasa biasa. 
https://pesona.travel/keajaiban/875/pulau-telaga-warna-dieng,Pulau Telaga Warna Dieng - Pesona Indonesia,Harmonisasi alam dengan udara yang sejuk dan bersih membuat suasana Telaga Warna Dieng begitu memikat. Anda juga akan merasakan suasana mistis yang hening disempurnakan oleh kabut putih dan pepohonan yang melingkupinya.
https://pesona.travel/keajaiban/5615/pura-mayura-poin-penting-yang-tertutup-keindahan-taman-mayura,"Pura Mayura, Poin Penting yang Tertutup Keindahan Taman Mayura - Pesona Indonesia","Sudah terkesima dengan keindahan Taman Mayura, banyak dari pelancong yang  kehilangan esensi utama dari salah satu tempat yang disakralkan di sekitar taman, yaitu Pura Mayura."
https://pesona.travel/keajaiban/3480/mabubung-menari-di-atap-tongkonan-toraja,"Ma'Bubung, Menari di Atap Tongkonan Toraja - Pesona Indonesia","Ritual ini biasanya dilakukan oleh seorang laki-laki. Menariknya orang yang melakukan ritual ini akan tampak berlarian tanpa rasa takut di atas atap Tongkonan, dengan pakaian adat Toraja lengkap."
https://pesona.travel/keajaiban/826/gemilang-kemenangan-di-istana-merdeka,Gemilang Kemenangan di Istana Merdeka - Pesona Indonesia,"Istana Merdeka, moniker yang tercipta saat Belanda mengalihkan kedaulatan kepada kita."
https://pesona.travel/keajaiban/2857/5-kuliner-ikonik-banyuwangi-menggigit-lidah-tapi-paling-dicari,"5 Kuliner Ikonik Banyuwangi, Menggigit Lidah Tapi Paling Dicari  - Pesona Indonesia","Kuliner khasnya berani, menggigit indera pengecap dengan paduan rasa dan menu yang tak biasa. Dari kombinasi rujak dan soto, pecel dan rawon hingga sambal yang menampar lidah. Jangan sampai lewatkan, 5 kuliner paling dicari dari Banyuwangi ini."
https://pesona.travel/keajaiban/4261/mencicipi-tape-ketan-cigugur-khas-cirebon,Mencicipi Tape Ketan Cigugur Khas Cirebon - Pesona Indonesia,Tape ketan Cigugur Cirebon memang berbeda dengan tape ketan biasanya. Tape ketan Cigugur seringkali menjadi makanan yang paling dicari ketika para wisatawan berkunjung ke Cirebon.
https://pesona.travel/keajaiban/3964/yuk-coba-sajian-sate-khas-bali-selain-sate-lilit,"Yuk, Coba Sajian Sate Khas Bali Selain Sate Lilit - Pesona Indonesia"," Jika ditanya apa kuliner khas Bali, yang terlintas pertama di kepala pasti sate lilit. Padahal masih banyak jenis sate lain yang unik dan mungkin Sobat Pesona hanya bisa temukan di pulau dewata."
https://pesona.travel/keajaiban/4470/ternyata-becak-ada-sejak-perang-dunia-ini-faktanya,"Ternyata Becak Ada Sejak Perang Dunia, Ini Faktanya - Pesona Indonesia","Pada 1950-an keberadaan becak di Yogyakarta sendiri mulai memasuki masa kejayaan. Kemudian, pada tahun 1970-an jumlah becak ini mulai berkembang pesat. Hal ini terjadi bersamaan dengan pembangunan ekonomi di masa awal Orde Baru Indonesia."
https://pesona.travel/keajaiban/1836/talad-thai-resto-cafe-gedung-belanda-rasa-thailand,"Talad Thai Resto, Cafe Gedung Belanda Rasa Thailand - Pesona Indonesia","Café ini sangat unik karena berdiri pada gedung bekas kolonialisme Belanda. Diperkirakan gedung ini dulunya bekas rumah dinas para prajurit perang Belanda saat zaman kolonialisme dulu. Gedung Belanda ini masih sangat terjaga keasliannya, dari mulai lantai"
https://pesona.travel/keajaiban/5319/wisata-tugu-wisata-menarik-tanpa-biaya,"Wisata Tugu, Wisata Menarik Tanpa Biaya - Pesona Indonesia","Ingin berwisata tanpa harus mengeluarkan biaya? Wisata tugu bisa jadi salah satu pilihan. Berlokasi di tengah kota, wisata tugu juga membuat kita lebih mengenal kota sendiri."
https://pesona.travel/front/forgot,Forgot Password - Pesona Indonesia,Forgot Password
https://pesona.travel/keajaiban/4220/semalam-di-bukit-siadtaratas-dan-tao-silalahi-sisi-toba-yang-romantis,"Semalam di Bukit Siadtaratas dan Tao Silalahi, Sisi Toba yang Romantis - Pesona Indonesia","Bukit Siadtaratas merupakan salah satu lokasi unggulan untuk menikmati alam Danau Toba yang tak ada duanya. Pemandangan dari atas bukit nan hijau, hamparan luasnya kaldera terbesar di Asia Tenggara, ditemani sepiring nasi pulen dan ikan mujahir segar, sun"
https://pesona.travel/keajaiban/6012/serunya-perjalanan-menuju-pantai-teluk-hijau,Serunya Perjalanan Menuju Pantai Teluk Hijau - Pesona Indonesia,"Jika menyukai petualangan, perjalanan trekking akan sangat menantang. Karena medan jalan akan melewati tebing dan lembah serta beberapa muara sungai, sandal gunung rasanya adalah pilihan alas kaki yang ideal."
https://pesona.travel/keajaiban/3074/menjajal-terbang-paralayang-dari-pegunungan-matantimali-palu,Menjajal Terbang Paralayang dari Pegunungan Matantimali Palu - Pesona Indonesia,"Paralayang Matantimali berada di ketinggian sekitar 1.000 meter di atas permukaan laut. Sangat pas untuk menguji adrenaline kita, bukan? Take off dari ketinggian tersebut kita akan disuguhkan pemandangan pegunungan yang mengelilingi Kota Palu, serta tentu"
https://pesona.travel/keajaiban/1683/danau-tage-lukisan-alam-di-bumi-papua,"Danau Tage, Lukisan Alam di Bumi Papua - Pesona Indonesia","Menikmati wisata alam air ditemani gugusan bukit indah yang menjulang di sekililingnya. Belum lagi, segarnya udara sekitar yang membuatnya kian lengkap. Tertarik mencicipi? Berkunjunglah ke Danau Tage di Kabupaten Paniai, Papua."
https://pesona.travel/keajaiban/2450/keindahan-pulau-pulau-terluar-di-indonesia-part-2,Keindahan Pulau-Pulau Terluar di Indonesia (Part 2) - Pesona Indonesia,"Banyaknya pulau, termasuk pulau-pulau terluar menjadi pesona luar biasa. Pulau-pulau terluar yang menjadi daya tarik wilayah perbatasan Indonesia, kini tak kalah menawan dan bersolek cantik. "
https://pesona.travel/keajaiban/1569/padang-bunga-abadi-jawa,Padang Bunga Abadi Jawa - Pesona Indonesia,"Gunung kembar di Pulau Jawa dengan lereng curam, berlembah dalam dan punggungan panjang menyangga. Gunung Gede menjulang 2.958 meter dan Gunung Pangrango 3.019 meter dari permukaaan laut."
https://pesona.travel/keajaiban/2642/tenun-baduy-yang-bersahaja-namun-mendunia,Tenun Baduy yang Bersahaja Namun Mendunia - Pesona Indonesia,"Awalnya dibuat dan dipakai hanya untuk kalangan sendiri. Kain tenun Baduy bukan sekadar kain penutup tubuh, tapi juga simbol status sosial yang melekat di ragam motifnya. Kini kain tenun Baduy merambah dunia luar, hingga panggung Paris Fashion Week!"
https://pesona.travel/keajaiban/5549/legenda-munculnya-batu-belimbing-di-toboali,Legenda Munculnya Batu Belimbing di Toboali - Pesona Indonesia,"Legenda yang indah inilah yang membuat Batu Belimbing menjadi salah satu destinasi yang tak boleh dilewatkan ketika berkunjung di Toboali, Bangka Selatan."
