https://pesona.travel/keajaiban/5820/3-kuliner-eksotik-oleh-oleh-khas-nias,"3 Kuliner Eksotik, Oleh-Oleh Khas Nias - Pesona Indonesia","Jalan-jalan ke Nias, jangan lupa belanja oleh-oleh khas dari pulau di perairan barat Sumatra ini. Seperti budayanya, olahan kuliner khas Nias pun istimewa. Bawa pulang secangkir Kopi Tabadu, nikmati sambil mengenang perjalanan ke pulau eksotik ini diteman"
https://pesona.travel/keajaiban/5804/berburu-hidang-ikan-patin-khas-melayu-riau,Berburu Hidang Ikan Patin Khas Melayu Riau - Pesona Indonesia,"Hidang, cara menyajikan semua menu makanan bersama-sama dalam piring-piring kecil. Gulai ikan patin disajikan bersama lauk lain, seperti ikan pantau, dendeng sapi cabai hijau, dan jenis lauk lainnya. Mirip penyajian pada masakan Minang. Warna, aroma dan s"
https://pesona.travel/keajaiban/5789/pizza-andaliman-makanan-italia-di-tanah-batak,"Pizza Andaliman, Makanan Italia di Tanah Batak - Pesona Indonesia","Kuliner hits di Balige, di tepian Danau Toba. Makanan dari negeri Menara Pisa ini diolah dengan cita rasa bumbu lokal khas tanah Batak, andaliman. Hal yang menarik pada pizza andaliman terletak di sausnya. Ada 3 jenis saus yang dihidangkan bersama pizza, "
https://pesona.travel/keajaiban/5776/mie-aceh-terlezat-di-sini-tempatnya,"Mie Aceh Terlezat, di Sini Tempatnya! - Pesona Indonesia","Makan mie Aceh sekarang ini bisa di mana saja. Tapi jika ingin mencicipi rasanya yang otentik, datanglah ke kota asalnya!"
https://pesona.travel/keajaiban/5775/5-tempat-kuliner-khas-dan-hits-di-malang,5 Tempat Kuliner Khas dan Hits di Malang - Pesona Indonesia,"Wisata kuliner di Malang tak ada habisnya. Apalagi di zaman media sosial sekarang ini, restoran yang menyajikan makanan enak dan lezat lebih mudah didapat."
https://pesona.travel/keajaiban/5774/uniknya-kuliner-khas-bromo,Uniknya Kuliner Khas Bromo  - Pesona Indonesia,"Melihat keindahan Bromo rasanya kurang lengkap jika tak mencicipi kuliner khasnya. Tak hanya nikmat, kuliner khas Bromo juga unik."
https://pesona.travel/keajaiban/6075/nikmati-kuliner-dan-senja-di-pantai-dermaga-bom-kalianda,Nikmati Kuliner dan Senja di Pantai Dermaga Bom Kalianda - Pesona Indonesia,"Menikmati suasana laut, angin, udara segar dan kulineran di pinggir pantai adalah kombinasi sempurna. Semua itu bisa disajikan dalam satu paket di Dermaga Bom Kalianda Lampung Selatan."
https://pesona.travel/keajaiban/6071/belum-pernah-ke-aceh-ini-alasan-mengapa-kita-harus-ke-serambi-mekkah,Belum Pernah ke Aceh? Ini Alasan Mengapa Kita Harus ke Serambi Mekkah - Pesona Indonesia,"Aceh bukan hanya sebuah daerah yang ketat akan peraturan islamnya. Lebih dari itu, ada banyak alasan bagi kita untuk berkunjung ke daerah berjuluk Serambi Mekkah ini."
https://pesona.travel/keajaiban/5571/kiara-park-bandung-bisa-kulineran-sambil-foto-foto,"Kiara Park Bandung, Bisa Kulineran Sambil Foto-Foto - Pesona Indonesia","Kiara Artha Park juga cocok untuk berburu kuliner. Tempatnya di sebelah utara taman yakni street food berupa tenda-tenda dan ruangan besar terbuka yang menghadap taman. Setelah kenyang makan, bisa berkeliling mengunjungi Monumen Taman Asia Afrika. Kiara A"
https://pesona.travel/keajaiban/5557/menikmati-bandung-dari-menara-masjid-raya,Menikmati Bandung dari Menara Masjid Raya - Pesona Indonesia,"Begitu pintu lift terbuka di puncak menara, pemandangan 360 derajat Kota Bandung menjadi milik kita, termasuk potret permukiman padat yang membentuk kota ini. Sebuah pengalaman menarik bisa bikin takjub siapa pun selama 15 menit berada di menara. "
https://pesona.travel/keajaiban/5554/menikmati-pesona-hutan-pinus-dan-curug-layung,Menikmati Pesona Hutan Pinus dan Curug Layung - Pesona Indonesia,Rasa lelah berjalan kaki sekira 30 menit terbayar tunai oleh pesona Curug Layung yang airnya demikian jernih dan dingin. Curug ini bukanlah air terjun yang tinggi dan lebar. Kurang lebih tingginya dua hingga empat meter dan terbagi dua air terjun. Air ter
https://pesona.travel/keajaiban/5530/wisata-ke-kampung-pelangi-200-disambut-rumah-warna-warni,"Wisata ke Kampung Pelangi 200, Disambut Rumah Warna-Warni - Pesona Indonesia",Perkampungan yang dibangun di lereng dengan kemiringan sekira 30 derajat tersebut terlihat estetik dari tepi Sungai Cikapundung.  Ribuan kaleng cat aneka warna telah dihabiskan untuk mewarnai dinding luar rumah seisi kampung. Warga setempat melakukannya s
https://pesona.travel/keajaiban/5497/yuk-lihat-pembuatan-wayang-golek-di-cupumanik,"Yuk, Lihat Pembuatan Wayang Golek di Cupumanik - Pesona Indonesia","Galeri Wayang Golek Cupumanik berada Jalan Kebon Kawung, tepatnya di Jalan H Akbar. Memang, letaknya tak terlihat langsung di jalan raya, tapi untuk mencapai galeri cukup mudah karena lokasinya tak jauh dari Stasiun Bandung. Bahkan, kawasan tersebut terbi"
https://pesona.travel/keajaiban/5465/factory-tour-ke-dapur-sablon-c59,Factory Tour ke Dapur Sablon C59 - Pesona Indonesia,C59 lahir sebagai kependekan dari Caladi Lima Sembilan. Caladi merupakan salah satu gang yang diambil dari nama burung pelatuk. Sementara angka 59 nomor rumah yang menjadi tempat usaha ini dimulai pada tahun 1980. Industri yang digagas dan dirintis oleh M
https://pesona.travel/keajaiban/6065/10-destinasi-wisata-unggulan-di-biak,10 Destinasi Wisata Unggulan di Biak - Pesona Indonesia,Salah satu keindahan alam yang dimiliki Papua ada di Pulau Biak. Pesonanya tak kalah indah dari Raja Ampat maupun pulau-pulau lainnya di Papua. Bahkan di Biak juga punya “Raja Ampat” versinya tersendiri. Berikut ini adalah list-nya.
https://pesona.travel/keajaiban/6060/10-destinasi-favorit-saat-liburan-ke-sumenep,10 Destinasi Favorit Saat Liburan ke Sumenep - Pesona Indonesia,"Paket wisata ke Sumenep bisa dibilang cukup lengkap, karena kita bisa berkunjung mulai dari pantai, gili, hingga ke wisata religi dan sejarah. Salah satu destinasi daerah yang wajib kita kunjungi ketika berada di Jawa Timur."
https://pesona.travel/keajaiban/6058/10-wisata-air-yang-bisa-ditemukan-di-pulau-bintan,10 Wisata Air yang Bisa Ditemukan di Pulau Bintan - Pesona Indonesia,"Wisata air menjadi salah satu unggulan di Pulau Bintan. Bahkan di Bintan kita bisa bermain di wahana air terbesar di Asia Tenggara, loh! Yuk, kita lihat keseruan apa saja yang bisa kita lakukan di Pulau Bintan."
https://pesona.travel/keajaiban/6055/tempat-makan-mangut-lele-paling-enak-di-yogyakarta,Tempat Makan Mangut Lele Paling Enak di Yogyakarta - Pesona Indonesia,"Tak hanya dikenal dengan hidangan yang manis-manis saja, Yogyakarta juga punya hidangan khas dengan cita rasa pedas menggigit, yaitu mangut lele. Berikut adalah tempat makan mangut lele paling enak di Yogyakarta."
https://pesona.travel/keajaiban/6046/pedasnya-nasi-tempong-indra-khas-banyuwangi-di-bali,Pedasnya Nasi Tempong Indra Khas Banyuwangi di Bali - Pesona Indonesia,"Sajian andalan dari Nasi Tempong Indra adalah ayam lalapan, yang merupakan ayam kampung goreng dengan gorengan kering hingga terasa kriuknya saat tergigit namun bumbu dari ayam juga masih terasa."
https://pesona.travel/keajaiban/6043/nikmati-indahnya-senja-di-waduk-cengklik-solo,Nikmati Indahnya Senja di Waduk Cengklik Solo - Pesona Indonesia,"Jika berkunjung ke Kabupaten Boyolali tepatnya di perbatasan antara Boyolali dan Karanganyar, di sinilah terdapat sebuah destinasi wisata yang cukup dikenal oleh masyarakat sekitar, yaitu Waduk Cengklik."
https://pesona.travel/keajaiban/6040/tengkleng-yu-tentrem-kuliner-rakyat-jelata-yang-naik-kelas-6040,"Tengkleng Yu Tentrem, Kuliner Rakyat Jelata yang Naik Kelas - Pesona Indonesia",Tengkleng Yu Tentrem menjadi laris sejak keluarga Cendana Penguasa Orde baru waktu itu memesannya. Sejak itulah Tengkleng Yu Tentrem menjadi favorit dan jujukan makan tengkleng orang dan beberapa pejabat yang sedang melakukan lawatan ke Solo.
https://pesona.travel/keajaiban/6037/taman-selecta-taman-bunga-tua-di-kota-batu,"Taman Selecta, Taman Bunga Tua di Kota Batu - Pesona Indonesia","Taman Selecta juga mudah dijangkau, karena tidak terlalu jauh dari pusat kota Malang. Terletak di Desa Tulungrejo, Kota Batu. Bisa ditempuh dengan jarak perjalanan kurang lebih 25 km dari pusat kota Malang, atau  4 km dari pusat Kota Batu."
https://pesona.travel/agenda/5635/festival-mahakam-2019,Festival Mahakam 2019 - Pesona Indonesia,"Festival Mahakam tahun ini juga masih menyajikan berbagai perlombaan yang dijamin seru. Kita bisa menyaksikan lomba berenang, balap perahu naga, tambangan, power boating, jet ski, dan masih banyak lagi. Semuanya akan diselenggarakan di atas Sungai Mahakam"
https://pesona.travel/agenda/5631/festival-kerinci-2019,Festival Kerinci 2019 - Pesona Indonesia,"Ada hal unik dari rangkaian Festival Kerinci 2019, salah satunya resepsi nikah massal gratis, yang digelar pada 5 November di Dermaga Danau Kerinci. Acara akan diisi dengan jamuan kuliner tradisional khas Kerinci dan penampilan seni budaya khas. Unik, buk"
https://pesona.travel/agenda/5630/tour-de-singkarak-2019,Tour de Singkarak 2019 - Pesona Indonesia,"Tour de Singkarak merupakan event balapan sepeda jalan raya jarak jauh dan berlangsung selama seminggu. Ratusan pembalap akan bertarung menjadi tercepat untuk menaklukan rute sepanjang 1.317,3 kilometer, yang terbagi dalam sembilan etape Tour de Singkarak"
https://pesona.travel/agenda/5534/sabang-freedive-2019,Sabang Freedive 2019 - Pesona Indonesia,"Sabang Freedive 2019 akan mempertandingkan tiga kategori utama, yaitu Constant Weight, Free Immersion (FIM), dan Constant Weight No Fins (CNF). Para penyelam tak hanya bisa menikmati keindahan dan kesunyian laut dengan napas tunggal saja."
https://pesona.travel/agenda/5376/jakarta-fashion-week-2020,Jakarta Fashion Week 2020 - Pesona Indonesia,"JFW 2020 menampilkan karya lebih dari 270 label dan desainer, baik nasional maupun internasional dengan lebih dari 2.800 koleksi busana terbaru. Deretan nama desainer ternama ikut meramaikan gelaran yang sudah memasuki tahun ke-12 ini. Beberapa di antaran"
https://pesona.travel/agenda/5372/jakarta-marathon-2019-5372,Jakarta Marathon 2019 - Pesona Indonesia,"Rute Electric Jakarta Marathon 2019 akan membawa para peserta menikmati keindahan landmark-landmark ikonik di kota Jakarta, seperti Kawasan Kota Tua, Fatahillah Square, Gereja Katedral, Masjid Istiqlal, dan akan melintasi kemegahan gedung–gedung pencakar "
https://pesona.travel/agenda/5309/festival-al-mizan-2019,Festival Al-Mizan 2019 - Pesona Indonesia,"Gelaran beragam seni tradisi dan budaya adalah upaya untuk melembutkan kekakuan sikap sekaligus menampilkan penghargaan terhadap perbedaan. Hal ini, sejalan dengan pemahaman religiusitas dan semangat humanisme Al-Mizan."
https://pesona.travel/agenda/5243/ubud-writers-readers-festival-2019,Ubud Writers & Readers Festival 2019 - Pesona Indonesia,"Tahun ini festival mengusung tema ‘Karma’. Festival yang diprakarsai Yayasan Mudra Swari Saraswati ini akan diminati banyak kalangan. Bukan hanya para pencinta sastra. Para penggemar seni, pemerhati budaya, dan masyarakat bakal tertarik. Karena semua masa"
https://pesona.travel/agenda/5224/pesona-nusa-dua-fiesta-2019,Pesona Nusa Dua Fiesta 2019 - Pesona Indonesia,"Pada pembukaan acara, 25 Oktober nanti, kita dapat menyaksikan sajian Colossal Dance dan pertunjukkan Band HIVI. Sedangkan di hari kedua, ada Padi Reborn akan menghentak panggung pertunjukan. Sementara pada hari ketiga, giliran Fourtwnty yang akan menghib"
https://pesona.travel/agenda/5059/festival-pesona-bahari-raja-ampat-2019,Festival Pesona Bahari Raja Ampat 2019 - Pesona Indonesia,"Festival Pesona Bahari Raja Ampat 2019 digelar 18-22 Oktober. Event ini akan diawali di Pantai Waisai Torang Cinta, Raja Ampat. Tema yang diangkat adalah Exotic Raja Ampat, From Ridge to Reef."
https://pesona.travel/agenda/5056/festival-hudoq-2019,Festival Hudoq 2019 - Pesona Indonesia,"Hudoq adalah persembahan masyarakat buat penguasa jagat raya, serta penguaasa tanah di bumi, juga air. Serta leluhur masyarakat yang diyakini berada di Apau Lagan atau dunia yang ada di langit. "
https://pesona.travel/inspirasi/6086/the-jacksons-jadi-line-up-utama-jakarta-international-java-jazz-festival-2020,The Jacksons Jadi Line Up Utama Jakarta International Java Jazz Festival 2020 - Pesona Indonesia,Jakarta International Jazz Java Festival edisi ke-16 hadir kembali dengan tema “Redeem Yourself Through Music”. 
https://pesona.travel/inspirasi/6085/rangkaian-panjang-balikpapan-fest-2020-ada-42-event,"Rangkaian Panjang Balikpapan Fest 2020, Ada 42 Event  - Pesona Indonesia","Ada 42 kegiatan dalam Balikpapan Fest 2020 nanti. Rangkaian event Balikpapan Festival diawali dengan BPN GO 123, kegiatan dengan konten kuliner, lifestyle dan fashion ini akan berlangsung di Balikpapan Tennis Stadium, yang berlangsung pada 5-9 Februari 20"
https://pesona.travel/inspirasi/6083/bogor-street-festival-2020-angkat-budaya-indonesia-timur,"Bogor Street Festival 2020, Angkat Budaya Indonesia Timur - Pesona Indonesia","Mengusung tema ‘Looking Eastward’, Bogor Street Festival 2020 menampilkan ragam seni dan budaya yang berbeda dari tahun-tahun sebelumnya. Tema tahun ini memiliki nilai filosofis, yakni arah terbitnya matahari sebagai sumber dari kecerdasan. "
https://pesona.travel/inspirasi/6081/festival-pesona-bau-nyale-2020-sajikan-7-konten-khas-lombok,"Festival Pesona Bau Nyale 2020, Sajikan 7 Konten Khas Lombok - Pesona Indonesia","Festival Pesona Bau Nyale 2020 dipusatkan di Pantai Tanjung Aan, Pujut, Lombok Tengah, Nusa Tenggara Barat. Bau Nyale sendiri merupakan ritual tahunan menangkap Cacing Laut, yang menurut mitos adalah jelmaan Putri Mandalika."
https://pesona.travel/inspirasi/6080/festival-cap-go-meh-singkawang-2020-hadirkan-replika-pagoda,Festival Cap Go Meh Singkawang 2020 Hadirkan Replika Pagoda  - Pesona Indonesia,"Ada pesan khusus dari tinggi replika Pagoda ini. Ketinggiannya yang mencapai 20,20 Meter menjadi lambang tahun 2020. Untuk lebar bangunan 15 Meter berarti hari ke-15 Imlek. "
https://pesona.travel/inspirasi/6062/gendang-tasa-khas-pariaman-dapat-rekor-muri,Gendang Tasa Khas Pariaman Dapat Rekor MURI - Pesona Indonesia,"Gandang tasa merupakan salah satu alat musik tradisional Pariaman yang biasanya digunakan untuk pesta, seperti pesta pernikahan, acara hoyak tabuik piaman, alek nagari dan acara lainnya."
https://pesona.travel/inspirasi/6042/ntt-mendapat-best-value-places-to-visit-in-2020-versi-lonely-planet,NTT Mendapat “Best Value Places to Visit in 2020” Versi Lonely Planet - Pesona Indonesia,"Menurut Lonely Planet, di NTT wisatawan bisa merasa seperti pelopor. Karena, belum banyak orang yang berkunjung. Kondisi yang berbeda jika wisatawan berkunjung ke Bali, Lombok, dan Kepulauan Gili."
https://pesona.travel/inspirasi/6026/total-16-atraksi-budaya-panaskan-festival-pesona-minangkabau-2019,Total 16 Atraksi Budaya Panaskan Festival Pesona Minangkabau 2019 - Pesona Indonesia,"Total, dikabarkan akan ada 16 atraksi budaya khas Minangkabau yang akan memanjakan para wisatawan yang hadiri Festival Pesona Minangkabau 2019 ini."
https://pesona.travel/inspirasi/6016/festival-pesona-minangkabau-2019-akan-pecahkan-rekor-muri,Festival Pesona Minangkabau 2019 Akan Pecahkan Rekor MURI - Pesona Indonesia,"Salah satu atraksi yang harus ditunggu adalah rencana pemecahan rekor Muri penampilan talempong pacik terbanyak. Talempong adalah alat musik pukul tradisional khas Minangkabau. Rencananya, aksi pemecahan rekor MURI talempong pacik di Festival Pesona Minan"
https://pesona.travel/member/704/menikmati-keindahan-nusa-penida-bali,"Menikmati Keindahan Nusa Penida, Bali - Pesona Indonesia",Nusa Penida menjadi terkenal karena banyak spot dengan pemandangan indah yang khas sehingga menjadi buruan untuk objek foto yang diunggah di Instagram. Pemandangan pantai serta lautan dari bukit dan tebing menjadi ikon Nusa Penida.
https://pesona.travel/pengirim/701/National-Geographic-Indonesia,Pesona Indonesia,"Pesona Indonesia menyajikan informasi tentang destinasi wisata, festival mislanya krakatau yang tersebar dari seluruh pelosok nusantara ini untuk Anda dan semua yang akan melakukan perjalanan baik di bulan Agustus atau kapanpun"
https://pesona.travel/member/703/menelisik-kisah-jalur-rempah-di-ternate-dan-tidore,Menelisik Kisah Jalur Rempah di Ternate dan Tidore - Pesona Indonesia,Ternate dan Tidore adalah dua pulau kecil yang berdampingan di Laut Maluku. Sejarah dan tradisi budaya lokalnya akan memikat Anda yang tertarik dengan kisah-kisah lampau yang tercatat dalam sejarah
https://pesona.travel/member/688/8-hal-yang-harus-diperhatikan-ketika-berlibur-di-bali-saat-nyepi,8 Hal yang Harus Diperhatikan Ketika Berlibur di Bali Saat Nyepi - Pesona Indonesia,"Pulau Bali yang mayoritas penduduknya beragama Hindu akan berhenti beraktivitas di Hari Nyepi. Jika Anda ingin menghabiskan waktu berlibur di Bali pada Hari Raya Nyepi, ada baiknya taati dan hormati beberapa aturan penduduk setempat, seperti berikut:"
https://pesona.travel/member/689/mencicipi-ambal-pizza-ala-kota-cengkeh,"Mencicipi Ambal, Pizza ala Kota Cengkeh - Pesona Indonesia","Jika suatu saat Anda berlibur di Toli-Toli, jangan lewatkan kesempatan mengunjungi Pantai Lalos dan mencecap kelezatan Ambal, kuliner berbentuk bulat layaknya Pizza."
https://pesona.travel/member/694/membangun-pariwisata-yang-berkelanjutan-ini-dia-destinasi-peraih-penghargaan-indonesia-sustainable-tourism-awards-2018,"Membangun Pariwisata yang Berkelanjutan, Ini Dia Destinasi Peraih Penghargaan Indonesia Sustainable Tourism Awards 2018 - Pesona Indonesia",Pembangunan pariwisata tentu harus disertai dengan konsep berkelanjutan (sustainable tourism).
https://pesona.travel/member/686/berkunjung-ke-museum-benteng-heritage,Berkunjung ke Museum Benteng Heritage - Pesona Indonesia,Namanya Museum Benteng Heritage yang merupakan barometer museum kebangsaan mewakili berbagai etnis.
https://pesona.travel/member/693/wae-rebo-desa-kerucut-di-balik-bukit,"Wae Rebo, Desa Kerucut di Balik Bukit - Pesona Indonesia","Jaraknya sekitar 9 kilometer dengan harus melewati tiga pos, Wae Lomba, Poco Roko, Nampe Bakok."
https://pesona.travel/member/685/berkat-kreativitas-warganya-desa-ponggok-sukses-menjadi-desa-mandiri,"Berkat Kreativitas Warganya, Desa Ponggok Sukses Menjadi Desa Mandiri - Pesona Indonesia","Berkat kreativitas komunitas lokal dan aparatur Desa Ponggok, mereka mampu meningkatkan taraf hidup masyarakat lokal."
https://pesona.travel/bekal-pejalan/6087/liburan-dengan-jaga-jarak-dan-tetap-di-rumah-saja-tetap-seru-dengan-jalan-jalan-online-ikut-yuk,"Liburan dengan Jaga Jarak dan Tetap di Rumah Saja? Tetap Seru dengan Jalan - Jalan Online, Ikut Yuk! - Pesona Indonesia",Berkeliling alam Indonesia yang mempesona masih bisa dilakukan oleh Sobat Pesona walaupun jaga jarak dan tetap di rumah aja. Coba saja jalan-jalan online dengan merasakan sensasi keliling Indonesia tanpa cemas jaga jarak dan bisa dinikmati di rumah aja. Y
https://pesona.travel/bekal-pejalan/5978/sebelum-ke-bunaken-ini-penjelasan-transportasi-dan-penginapannya,"Sebelum ke Bunaken, Ini Penjelasan Transportasi dan Penginapannya - Pesona Indonesia","Dari Kuala Jengki, taman nasional hanya berjarak sekitar 45 menit saja. Rasa lelah akan terganti ketika sampai di surganya menyelam dunia ini. Perjalanan menggunakan moda air ini pun cukup terjangkau, yakni Rp30.000 untuk sekali jalan."
https://pesona.travel/bekal-pejalan/5965/liburan-ke-wamena-mahal-banget-ini-trip-hemat-ke-wamena,Liburan Ke Wamena Mahal Banget? Ini Trip Hemat ke Wamena - Pesona Indonesia,"Hingga saat ini, alat transportasi ke Kabupaten Jayawijaya masih mengandalkan perhubungan udara. Sedangkan transportasi darat yang menghubungkan Wamena dengan empat puluh distrik salah satunya yaitu Lembah Baliem sudah dapat dijangkau dengan kendaraan ber"
https://pesona.travel/bekal-pejalan/5964/ingin-melakukan-perjalanan-ke-bunaken-ini-tipsnya,Ingin Melakukan Perjalanan ke Bunaken? Ini Tipsnya - Pesona Indonesia,"Perjalanan ke Bunaken dari Kuala Jengki, bisa dilakukan dengan menumpang kapal motor cepat. Tarif untuk sekali perjalanan hanya Rp30.000 per orang. Jauh lebih murah jika datang sendiri atau berdua."
https://pesona.travel/bekal-pejalan/5952/ingin-pergi-traveling-bersama-balita-simak-dulu-6-tips-ini,Ingin Pergi Traveling Bersama Balita? Simak Dulu 6 Tips Ini - Pesona Indonesia,Berlibur bersama keluarga kecil sedang menjadi trend masa kini. Kebanyakan orang tua milenial beranggapan bahwa traveling bersama balita bisa merekatkan bonding antar anggota keluarga dan memberikan kenangan manis untuk si kecil.
https://pesona.travel/bekal-pejalan/5830/tips-memotret-landscape-dengan-hasil-menawan,Tips Memotret Landscape Dengan Hasil Menawan - Pesona Indonesia,"Memotret landscape bukanlah hal yang sulit jika hanya mementingkan luasnya wilayah yang diabadikan. Tapi, lain halnya jika ingin membuat foto tersebut lebih bernilai."
https://pesona.travel/keajaiban/5984/serunya-bercanda-dengan-satwa-di-ragunan,Serunya Bercanda dengan Satwa di Ragunan - Pesona Indonesia,"Tahukah Sobat Pesona, ternyata Ragunan mempunyai sejarah yang cukup panjang. Taman Margasatwa Ragunan merupakan taman margasatwa pertama yang dimiliki Indonesia."
https://pesona.travel/keajaiban/5963/gereja-toasebio-gereja-katolik-dengan-akulturasi-budaya-tionghoa,"Gereja Toasebio, Gereja Katolik dengan Akulturasi Budaya Tionghoa - Pesona Indonesia","Saking kentalnya nuansa arsitektur Tionghoa pada gereja Toasebio, hingga altar tempat sembahyang dijadikan altar gereja yang didominasi warna merah khas etnis Tiongkok."
https://pesona.travel/keajaiban/5862/ajak-anak-bermain-sambil-belajar-di-sini,Ajak Anak Bermain Sambil Belajar di Sini! - Pesona Indonesia,"Cara terbaik untuk mengajak anak belajar adalah dengan bermain. Jadi, manfaatkan liburan untuk mengajak anak belajar sambil belajar di berbagai tempat wisata edukasi."
https://pesona.travel/destinasi/947/jakarta-barat-arsitektur-kolonial-belanda-hingga-chinatown,"Jakarta Barat, Arsitektur Kolonial Belanda Hingga Chinatown - Pesona Indonesia","Jakarta Barat sebagian wilayahnya memang merupakan pemukiman penduduk dan gedung perkantoran. Bisa dikatakan hampir cukup sulit menemukan tempat wisata di daerah ini. Namun, nyatanya selain mall ada beberapa tempat wisata di Jakarta Barat yang tidak boleh"
https://pesona.travel/destinasi/946/jakarta-selatan-surganya-mall-mewah,"Jakarta Selatan, Surganya Mall Mewah - Pesona Indonesia","Boleh dikatakan jika Jakarta dikenal sebagai kota seribu mall di Indonesia, terlebih di kawasan Jakarta Selatan. Kawasan ini seolah menyajikan wisata mall yang tak habis-habisnya bagi warga Jakarta."
https://pesona.travel/destinasi/945/jakarta-pusat-wisata-religi-di-gereja-dan-masjid,"Jakarta Pusat, Wisata Religi di Gereja dan Masjid - Pesona Indonesia","Jakarta Pusat, kota yang sengaja dibangun dengan infrastruktur yang modern. Maklum saja, Jakarta Pusat merupakan pusat pemerintahan di Jakarta. Mulai dari ekonomi, politik, hingga dianggap sebagai titik utama kemacetan di Ibu kota. Namun, di balik semua i"
https://pesona.travel/destinasi/944/jakarta-utara-memiliki-banyak-wahana-bermain-yang-seru,"Jakarta Utara, Memiliki Banyak Wahana Bermain yang Seru - Pesona Indonesia","Jakarta Utara merupakan bagian dari kota Jakarta yang berbatasan langsung dengan laut. Dengan kondisi itu, secara otomatis ada banyak tempat wisata di Jakarta Utara selain mall yang wajib kita kunjungi"
https://pesona.travel/keajaiban/5902/bukit-gundul-dan-pemandangan-sang-surya-5902,Bukit Gundul dan Pemandangan Sang surya - Pesona Indonesia,"Penamaan bukit ini diambil dari kata meisik yang berarti gundul, oleh karena itu bukit ini dapat diartikan sebagai bukit gundul. "
https://pesona.travel/keajaiban/5901/pura-meru-jejak-agama-hindu-di-lombok,"Pura Meru, Jejak Agama Hindu di Lombok - Pesona Indonesia","Jika Sobat Pesona berlibur ke Pulau Lombok, tidak ada salahnya untuk menyempatkan diri mampir ke tempat-tempat wisata sejarah. Meski Lombok dikenal sebagai pulau seribu masjid yang mayoritas penduduknya beragama Islam, namun jejak agama Hindu berupa bangu"
https://pesona.travel/keajaiban/5900/kedis-lombok-si-mungil-yang-menawan-di-gugusan-gili-lombok-5900,"Kedis Lombok, Si Mungil yang Menawan di Gugusan Gili Lombok - Pesona Indonesia",Nusa Tenggara Barat punya banyak sekali pulau kecil atau gili yang memesona. Salah satunya adalah Gili Kedis yang kini semakin hits di kalangan traveler.
https://pesona.travel/destinasi/5579/pesona-mataram-kota-mantan-kerjaan-yang-terus-berkembang,"Pesona Mataram, Kota Mantan Kerjaan yang Terus Berkembang - Pesona Indonesia","Pulau Lombok terdiri dari beberapa kota dan kecamatan. Satu di antaranya adalah Kota Mataram. Dengan banyaknya peristiwa sejarah yang terjadi di wilayah ini, Mataram menjadi kota dengan daya tarik unik sekaligus kaya akan keindahan alam khas Lombok.
"
https://pesona.travel/destinasi/4950/menjajal-selancar-di-pantai-maluk-sumbawa,Menjajal Selancar di Pantai Maluk Sumbawa - Pesona Indonesia,"Selain mempunyai pemandangan yang memikat hati, Pantai Maluk Sumbawa terkenal dengan ombak besar dan terbaik untuk surfing."
https://pesona.travel/destinasi/3076/kabupaten-dompu-keindahan-di-jantung-sumbawa,"Kabupaten Dompu, Keindahan di Jantung Sumbawa - Pesona Indonesia","Kabupaten Dompu termasuk daerah yang beriklim tropis dengan musim hujan rata-rata bulan Oktober sampai April setiap tahun. Pada musim kemarau, suhu udara relatif rendah (20°C - 30°C) pada siang hari dan di bawah 20°C pada malam hari."
https://pesona.travel/destinasi/3075/5-destinasi-sumbawa-barat-dijamin-bikin-betah-3075,"5 Destinasi Sumbawa Barat, Dijamin Bikin Betah - Pesona Indonesia","Pulau Sumbawa terbagi atas 4 kabupaten dan 2 kota. Yaitu Kabupaten Sumbawa Barat, Sumbawa, Dompu, Bima serta dua kota bernama Sumbawa Besar dan Bima. Pulau di sebelah timur pulau Lombok ini memiliki destinasi yang masih alami, tak kalah elok dengan Lombok"
