https://pesona.travel/keajaiban/468/pendalungan-kalau-jawa-ketemu-madura,"Pendalungan, Kalau Jawa Ketemu Madura - Pesona Indonesia","Pendalungan erat kaitannya dengan demografi atau kewilayahan. Sebagai contoh misalnya masyarakat Sunda dikenal sebagai Pasundan, Betawi di Jakarta, kemudian ke arah timur lagi ada masyarakat Mataraman di Yogyakarta dan Solo. Pendalungan adalah istilah unt"
https://pesona.travel/keajaiban/402/petualangan-kuliner-sulawesi-utara-ikonik-dan-sensasional,"Petualangan Kuliner Sulawesi Utara, Ikonik dan Sensasional - Pesona Indonesia","Sulawesi Utara dikenal karena keindahan alamnya, dan kelezatan kulinernya. Makanan khas Sulawesi bagian utara sangat kondang dan tersebar hingga ke berbagai kawasan Nusantara. Masyarakat Manado dan berbagai daerah di ujung utara Sulawesi ini lihai mengola"
https://pesona.travel/keajaiban/1068/tak-hanya-enak-rendang-lambang-keutuhan-suku-minangkabau,"Tak Hanya Enak, Rendang Lambang Keutuhan Suku Minangkabau - Pesona Indonesia","Masuk dalam daftar makanan terenak di dunia, Rendang memiliki kelezatan yang dapat membuat ketagihan. Masakan ini dihasilkan dari proses memasak berjam-jam, atau sekitar 4 jam hingga kering dan berwarna hitam pekat. Dalam suhu ruangan, rendang dapat bertahan"
https://pesona.travel/keajaiban/5843/dodol-rumput-laut-oleh-oleh-khas-lombok,"Dodol Rumput Laut, Oleh-oleh Khas Lombok - Pesona Indonesia","Dodol rumput laut sejatinya mirip dengan dodol pada umumnya. Bedanya, dodol ini terbuat dari tepung rumput laut. Inilah camilan dan oleh-oleh khas Lombok."
https://pesona.travel/keajaiban/2557/menikmati-sunset-dari-balik-jendela-marina-cottages-ampana,Menikmati Sunset dari Balik Jendela Marina Cottages Ampana - Pesona Indonesia,"Masing-masing kamar memiliki lima cottages. Total keseluruhannya, terdapat 20 cottages dengan teras yang berlokasi di pinggir pantai. Selain itu, terdapat Hall yang cukup nyaman untuk berkumpul di malam hari sembari menghabiskan waktu bersama anggota kelu"
https://pesona.travel/keajaiban/5966/yuk-coba-angkot-modifikasi-di-padang,"Yuk, Coba Angkot Modifikasi di Padang - Pesona Indonesia","Ada yang menarik, angkutan umum di Padang ini disebut-sebut paling ciamik di kota Rendang. Pasalnya kendaraan ini dilengkapi dengan CCTV, TV,  serta mini bar di dalamnya."
https://pesona.travel/keajaiban/2347/pelabuhan-ulee-lheue-gerbang-laut-keluar-masuk-aceh,"Pelabuhan Ulee Lheue, Gerbang Laut Keluar Masuk Aceh - Pesona Indonesia","Awalnya Pelabuhan Ulee Lheue ini beroperasi melayani beberapa rute, seperti penyeberangan ke Pulau Sabang, Kota Lhokseumawe, Kuala Langsa, bahkan sampai ke Pelabuhan Belawan, Medan. Setelah bencana tsunami tahun 2004, pelabuhan ini baru berperan sebagai p"
https://pesona.travel/keajaiban/6053/yuk-seru-seruan-di-pantai-natsepa-ambon,"Yuk, Seru-Seruan di Pantai Natsepa Ambon - Pesona Indonesia","Sst, ada kepercayaan masyarakat lokal bahwa berenang di Pantai Natsepa bisa menyembuhkan penyakit ringan, loh! Mau coba?"
https://pesona.travel/keajaiban/6049/serunya-menikmati-perjalanan-menuju-danau-kelimutu,Serunya Menikmati Perjalanan Menuju Danau Kelimutu - Pesona Indonesia,"Danau Kelimutu sendiri sebenarnya berada dalam Kawasan Taman Nasional Kelimutu terletak di wilayah Kabupaten Ende, Provinsi Nusa Tenggara Timur (NTT)."
https://pesona.travel/keajaiban/5578/berkunjung-ke-curug-sodong-bonus-indah-dari-geopark-ciletuh,"Berkunjung ke Curug Sodong, Bonus Indah dari Geopark Ciletuh - Pesona Indonesia","Lokasi Curug Sodong sendiri masih terbilang berada di daerah Sukabumi dan masih ada di dalam kawasan Geopark Ciletuh, tepatnya di Desa Ciwaru, Kecamata Ciemas, Sukabumi, Jawa Barat. Untuk saya, Curug Sodong adalah tempat yang tepat untuk beristirahat seje"
https://pesona.travel/profile-editor-tamu/46/list,Abrina - Editor Petualangan - Pesona Indonesia,"Pesona Indonesia menyajikan informasi tentang destinasi wisata, festival mislanya krakatau yang tersebar dari seluruh pelosok nusantara ini untuk Anda dan semua yang akan melakukan perjalanan baik di bulan Agustus atau kapanpun"
https://pesona.travel/keajaiban/5570/wisata-gunung-merapi-melihat-peninggalan-erupsi,"Wisata Gunung Merapi, Melihat “Peninggalan” Erupsi - Pesona Indonesia",Masyarakat sekitar akhirnya meraih rezeki dari kunjungan wisatawan yang semakin meningkat. Museum Gunung Merapi yang didirikan oleh pemerintah dan museum-museum mini yang dikelola penduduk dari rumah penduduk korban lava gunung merapi menjadi daya tarik
https://pesona.travel/keajaiban/5559/pantai-sadeng-keindahan-pantai-selatan-yogyakarta,"Pantai Sadeng, Keindahan Pantai Selatan Yogyakarta - Pesona Indonesia","Konon katanya, pantai ini adalah bekas muara Sungai Bengawan Solo pada jaman dulu. Tidak hanya cuci mata melihat pantai, di area ini juga terdapat beberapa lembah yang digunakan penduduk sekitar untuk bercocok tanam. Banyak perahu di sekitar pantai yang t"
https://pesona.travel/keajaiban/5536/bentangan-indah-bukit-di-bondowoso,Bentangan Indah Bukit di Bondowoso - Pesona Indonesia,"Melewati hutan pinus, sedikit offroad dan pastinya berdebu. Namun pemandangan luar biasa yang saya dapatkan menghapus semua kelelahan. Bukit terbentang di bagian timur, dan pegunungan di bagian barat.  Untuk masuk di kawasan ini tidaklah sulit."
https://pesona.travel/keajaiban/5437/uniknya-ombak-river-mouth-di-pantai-bojong-salawe,Uniknya Ombak River Mouth di Pantai Bojong Salawe - Pesona Indonesia,"Seperti halnya di Pantai Bojong Salawe ini, ombak di mulut sungai, atau para peselancar lebih sering memanggilnya dengan "
https://pesona.travel/profile-editor-tamu/36/list,Giang - Editor Petualangan - Pesona Indonesia,"Pesona Indonesia menyajikan informasi tentang destinasi wisata, festival mislanya krakatau yang tersebar dari seluruh pelosok nusantara ini untuk Anda dan semua yang akan melakukan perjalanan baik di bulan Agustus atau kapanpun"
https://pesona.travel/keajaiban/5428/menari-di-lautan-pasir-black-lava-kitamani,Menari di Lautan Pasir Black Lava Kitamani - Pesona Indonesia,"Perjalanan kali ini saya mulai dari Ubud yang seharusnya membuat saya di sana kurang dari waktu satu jam. Di perjalanan, saya membelah hutan-hutan kecil. Akhirnya, tibalah saya di Black Lava tanpa melewati jalanan aspal. Membutuhkan waktu 2,5 jam untuk ti"
https://pesona.travel/keajaiban/5393/ombak-kanan-yang-memikat-di-pantai-labuhan-jukung,Ombak Kanan yang Memikat di Pantai Labuhan Jukung - Pesona Indonesia,"Memang Labuhan Jukung tergolong pantai yang tidak berlebihan dalam membisniskan keindahan pantainya, karena masih melekat budaya dan kehidupan tradisional pada pantai ini. Jadi, selain menikmati keindahan alam, kita juga bisa belajar budaya lokal. "
https://pesona.travel/keajaiban/5362/berpetualangan-di-cukang-taneuh-green-canyon-nya-indonesia,"Berpetualangan di Cukang Taneuh, Green Canyon-nya Indonesia  - Pesona Indonesia","Untuk mencapai tempat ini kita harus menyewa sebuah perahu dari Dermaga Ciseureuh dan menempuh perjalanan kurang lebih 30-45 menit dengan jarak sekitar 3 km. Tarif tiket perahu berkisar Rp.200.000 , bisa didapat di loket pembelian tiket dengan harga terse"
https://pesona.travel/keajaiban/6029/menikmati-sunrise-bersama-lumba-lumba-di-wakatobi,Menikmati Sunrise Bersama Lumba-lumba di Wakatobi - Pesona Indonesia,Sangat disayangkan melewatkan sunrise di Wakatobi bersama lumba-lumba. Melihat secara langsung seakan sangat dekat dengan mereka akan menjadi pengalaman yang tak terlupakan selama berlibur di Wakatobi.
https://pesona.travel/keajaiban/6006/pemandangan-sepanjang-perjalanan-ke-taman-wisata-laut-17-pulau-riung,Pemandangan Sepanjang Perjalanan ke Taman Wisata Laut 17 Pulau Riung - Pesona Indonesia,"Perjalanan dari Ende ke Riung memang cukup panjang (sekitar 6 jam) dan berliku-liku dengan kontur naik turun, serta tak selamanya mulus."
https://pesona.travel/keajaiban/5995/perjalanan-menakjubkan-menuju-air-terjun-moni-flores,Perjalanan Menakjubkan Menuju Air Terjun Moni Flores - Pesona Indonesia,"Asiknya, sepanjang perjalanan kita disuguhi banyak pemandangan yang asri dan udara yang terasa sejuk. Di kiri-kanan jalan, umum ditemui perkebunan rakyat dengan berbagai macam varietas tanaman."
https://pesona.travel/keajaiban/5991/begini-cara-menuju-benteng-duurstede-maluku,Begini Cara Menuju Benteng Duurstede Maluku - Pesona Indonesia,"Satu-satunya cara menuju Benteng Duurstede dari Ambon adalah dengan menggunakan kapal, maklum Maluku adalah wilayah kepulauan. Sobat bisa naik kendaran umum jurusan Liang dari terminal pasar Mardika untuk turun di Pelabuhan Tulehu."
https://pesona.travel/keajaiban/5987/menuju-keindahan-alam-di-sipirok,Menuju Keindahan Alam di Sipirok - Pesona Indonesia,"Perjalanan ke Sipirok mungkin bisa menjadi salah satu pilihan. Sipirok adalah sebuah kota kecil yang tersimpan di wilayah Tapanuli Selatan, Sumatera Utara. Kota Sipirok merupakan sebuah kota yang hidup di balik megahnya gunung Sibual-bual."
https://pesona.travel/keajaiban/5975/menikmati-sunrise-di-kebun-teh-gunung-dempo,Menikmati Sunrise di Kebun Teh Gunung Dempo - Pesona Indonesia,Warna keemasan yang memantul mampu memberi keindahan yang sempurna. Ditambah dengan aroma tajam daun teh yang terhirup membuat hati menjadi segar.
https://pesona.travel/keajaiban/6076/menyibak-eksotisnya-kabut-rammang-rammang,Menyibak Eksotisnya Kabut Rammang-Rammang - Pesona Indonesia,"Ada dua kompleks taman hutan batu di Rammang-Rammang, yakni di utara dan selatan. Eksotisnya dikenal hingga mancanegara."
https://pesona.travel/keajaiban/6073/6-pantai-anti-mainstream-di-bali-yang-harus-dikunjungi,6 Pantai Anti-mainstream di Bali yang Harus Dikunjungi - Pesona Indonesia,"Tak salah jika Pulau Bali dijuluki sebagai Pulau Dewata. Ya, keindahan pulau ini memang juara, belum lagi keunikan budayanya. Buat Sobat Pesona yang ingin mengeksplorasi pantai-pantai di Bali, berikut ada 6 pantai anti-mainstream di Bali yang mungkin belu"
https://pesona.travel/keajaiban/5587/kampung-terapung-suku-bajo-dan-laut-wakatobi,Kampung Terapung Suku Bajo dan Laut Wakatobi - Pesona Indonesia,"Seperti memang sudah ditakdirkan Suku Bajo tinggal di Wakatobi, salah satu perairan terindah di dunia. Wakatobi terkenal dengan keanekaragaman hayati laut dan karang yang menempati salah satu posisi prioritas tertinggi dari konservasi laut di Indonesia."
https://pesona.travel/profile-editor-tamu/31/list,Barrykusuma - Editor Alam - Pesona Indonesia,"Pesona Indonesia menyajikan informasi tentang destinasi wisata, festival mislanya krakatau yang tersebar dari seluruh pelosok nusantara ini untuk Anda dan semua yang akan melakukan perjalanan baik di bulan Agustus atau kapanpun"
https://pesona.travel/keajaiban/5564/padang-selayang-pandang,Padang Selayang Pandang - Pesona Indonesia,"Tak memiliki banyak waktu di Padang? Saya merekomendasikan tempat-tempat unik dan asik ini buat kamu kunjungi, karena ikon ini sangat erat kaitannya dengan asal usul berdirinya Kota Padang."
https://pesona.travel/profile-editor-tamu/13/list,Raiyani Muharramah - Editor Budaya - Pesona Indonesia,"Pesona Indonesia menyajikan informasi tentang destinasi wisata, festival mislanya krakatau yang tersebar dari seluruh pelosok nusantara ini untuk Anda dan semua yang akan melakukan perjalanan baik di bulan Agustus atau kapanpun"
https://pesona.travel/keajaiban/5556/wisata-ke-pantai-tanjung-tinggi-di-negeri-laskar-pelangi,Wisata ke Pantai Tanjung Tinggi di Negeri Laskar Pelangi - Pesona Indonesia,Kondisi ini yang menjadikan Pantai Tanjung Tinggi kemudian menjadi lokasi wisata favorit di Belitung. Apalagi Pantai Tanjung Tinggi juga pernah dijadikan lokasi syuting film fenomenal Laskar Pelangi. Sejak saat itu tak sedikit wisatawan yang menyebut Pant
https://pesona.travel/keajaiban/5535/rekomendasi-wisata-saat-ke-wamena,Rekomendasi Wisata Saat ke Wamena - Pesona Indonesia,"Usai menikmati alam, sempatkanlah mampir ke Pasar Jibama. Pasar ini berada di pusat kota, bisa ditempuh selama 15 menit dengan menggunakan becak. Sobat Pesona mungkin bisa menemukan souvenir khas Papua di sini, seperti noken (tas) dan koteka, asal pandai-"
https://pesona.travel/keajaiban/5514/menikmati-alam-wakatobi-dari-segala-sisi-5514,Menikmati Alam Wakatobi dari Segala Sisi - Pesona Indonesia,"Banyak aktivitas yang dilakukan di pantai ini. Hamparan pasir membentang luas yang membuat kita tidak bosan bosan memotret landscape. Sobat Pesona juga bisa  snorkeling. Namun, harus hati hati, ya, karena banyak daerah karang dan masih banyak terdapat ula"
https://pesona.travel/keajaiban/5503/weekend-gateway-ke-belitung-yuk,"Weekend Gateway ke Belitung, Yuk! - Pesona Indonesia","Saya tidak punya banyak waktu untuk berlibur di akhir pekan kali ini. Namun, keinginan untuk rehat sejenak dari rutinitas ibukota juga semakin menggebu-gebu. Setelah berkali-kali bergonta ganti rencana tujuan, saya pun menjatuhkan pilihan pada Belitung un"
https://pesona.travel/profile-editor-tamu/43/list,Yusni Mustafa - Editor Alam - Pesona Indonesia,"Pesona Indonesia menyajikan informasi tentang destinasi wisata, festival mislanya krakatau yang tersebar dari seluruh pelosok nusantara ini untuk Anda dan semua yang akan melakukan perjalanan baik di bulan Agustus atau kapanpun"
https://pesona.travel/keajaiban/5500/berendam-di-kolam-air-panas-tinggi-raja-indah-dan-unik,"Berendam di Kolam Air Panas Tinggi Raja, Indah dan Unik - Pesona Indonesia","Tak sekedar berendam, kita juga bisa bermasker belerang disini, butiran belerang berwarna putih bersih bak scrub alami tersebar melimpah, hingga kita bisa menggosokan nya ke badan bak lulur. Dan kembalilah ke dalam sungai untuk membasuh badan."
https://pesona.travel/keajaiban/6069/ayo-bermain-air-di-5-air-terjun-di-geopark-ciletuh,Ayo Bermain Air di 5 Air Terjun di Geopark Ciletuh - Pesona Indonesia,"Menikmati suasana alam di antara riuhnya suara gemericik air, Geopark Ciletuh bisa dijadikan tempat wisata untuk menikmati indahnya pesona air terjun yang menarik."
https://pesona.travel/keajaiban/6066/tebing-marumasa-menikmati-indahnya-bulukumba-dari-ketinggian,"Tebing Marumasa, Menikmati Indahnya Bulukumba dari Ketinggian - Pesona Indonesia",Tak banyak orang tahu mengenai kawasan tebing Marumasa ini. Sehingga alam sekitarnya masih sangat alami nan cantik jauh dari hiruk-pikuk para wisatawan.
https://pesona.travel/keajaiban/6063/pesona-pantai-pandawa-yang-dijaga-para-dewa,Pesona Pantai Pandawa yang Dijaga Para Dewa - Pesona Indonesia,"Saking banyaknya pantai di Bali, terkadang kita jadi bingung untuk mulai dari mana. Pesona Travel merekomendasikan pantai Pandawa untuk Sobat Pesona kunjungi dan dijamin tidak akan mengecewakan."
https://pesona.travel/keajaiban/6061/selain-pulau-komodo-ini-5-destinasi-wajib-dikunjungi-di-labuan-bajo,"Selain Pulau Komodo, Ini 5 Destinasi Wajib Dikunjungi di Labuan Bajo - Pesona Indonesia","Keindahan panorama dan beragam hal unik yang ada membuat Labuan Bajo banyak digandrungi oleh wisatawan lokal maupun mancanegara. Namun, tak hanya pulau Komodo saja yang indah dan menakjubkan. Ada destinasi lain yang harus Sobat Pesona kunjungi di Labuan B"
https://pesona.travel/keajaiban/6059/padang-savana-lamboya-lokasi-dilaksanakannya-tradisi-pasola,"Padang Savana Lamboya, Lokasi Dilaksanakannya Tradisi Pasola - Pesona Indonesia","Di Sumba, setiap tahun dilakukan acara budaya Pasola. Acara ini diselenggarakan di padang savana hijau yang merupakan ciri khas dari Pulau Sumba, yaitu Lamboya."
https://pesona.travel/keajaiban/6057/hutan-tropis-eksotis-penuh-mistis-di-jawa-timur,Hutan Tropis Eksotis Penuh Mistis di Jawa Timur - Pesona Indonesia,Berwisata ke sebuah hutan yang dipenuhi pohon yang rindang tak akan terasa membosankan jika kita tahu apa saja keunikan dan daya tariknya. Taman Nasional Alas Purwo bisa jadi tempat untuk menikmati keindahan alam sekaligus menguji adrenalin karena cerita 
https://pesona.travel/keajaiban/6054/keindahan-alam-pulau-sumbawa-jadi-paket-lengkap-liburan-kita,Keindahan Alam Pulau Sumbawa Jadi Paket Lengkap Liburan Kita - Pesona Indonesia,"Wilayah timur Indonesia memang menyimpan segudang potensi wisata yang sayang jika dilewatkan, tidak terkecuali di Pulau Sumbawa. Gunung, pantai, hingga savana bisa kita dapat di Sumbawa."
https://pesona.travel/keajaiban/6052/inilah-5-keistimewaan-pantai-liang-yang-harus-kamu-ketahui,Inilah 5 Keistimewaan Pantai Liang yang Harus Kamu Ketahui - Pesona Indonesia,"Mungkin karena tidak sepopuler pantai-pantai di Bali dan Lombok, pantai Liang juga masih bersih dari sampah-sampah yang seringkali mengganggu pemandangan."
https://pesona.travel/keajaiban/6070/mengenal-asal-usul-makam-suci-raja-mataram-imogiri,Mengenal Asal Usul Makam Suci Raja Mataram Imogiri - Pesona Indonesia,"Menjadi salah satu objek wisata sejarah, makam suci di Imogiri merupakan makam raja dan keluarga kesultanan Mataram Islam yang melegenda. Berikut adalah cerita menariknya."
https://pesona.travel/keajaiban/6064/mengenal-alat-musik-tradisional-suku-dayak,Mengenal Alat Musik Tradisional Suku Dayak - Pesona Indonesia,"Setiap budaya memiliki kesenian dan kerajinan yang sudah ada sejak zaman dahulu. Beberapa di antaranya masih dilestarikan, seperti alat-alat musik tradisional dari Suku Dayak berikut ini."
https://pesona.travel/keajaiban/5550/kirab-pengantin-khitan-di-muludan-gegesik,Kirab Pengantin Khitan di Muludan Gegesik - Pesona Indonesia,"Banyak warga Gegesik bahkan dari kabupaten lain seperti Indramayu, Kuningan, Majalengka, Cirebon, datang menyaksikan acara Kirab Budaya hasil kreasi dari masyarakat 5 desa di kecamatan Gegesik dan Cirebon. Usai kirab, dilakukan penilaian hasil kreasinya. "
https://pesona.travel/keajaiban/5496/meriahnya-kirab-budaya-muludan-di-gegesik,Meriahnya Kirab Budaya Muludan di Gegesik - Pesona Indonesia,"Tradisi mengarak pusaka Gegesik memang merupakan budaya masyarakat Gegesik yang sudah dilaksanakan turun-temurun dan sudah menjadi agenda tahunan sebagai puncak peringatan Maulid Nabi untuk mempererat silaturahmi antara kuwu-kuwu, masyarakat Desa Gegesik "
https://pesona.travel/keajaiban/5474/tarian-perang-dan-bakar-batu-wamena,Tarian Perang dan Bakar Batu Wamena - Pesona Indonesia,"Dan saat itu juga mereka menyantapnya dengan lahap, tanpa memperdulikan panas yang masih mengepul.  Semua mendapat bagian, pace, mace anak-anak berbagi makanan, dalam suasana akrab dan hangat, tawa canda dan antusias melahap hipere. Dari sebuah tampilan T"
https://pesona.travel/keajaiban/5473/belajar-budaya-suku-dayak-kenyah-di-desa-pampang,Belajar Budaya Suku Dayak Kenyah di Desa Pampang - Pesona Indonesia,"Setiap Minggu, dari jam 2 hingga 4 sore, kesenian Dayak Kenyah dipertontonkan. Tari-tarian anak-anak, remaja putra, remaja putri, hingga ibu-ibu. Selain Tarian Perang Dayak, ada juga permainan bambu yang melibatkan penonton. Beberapa pasang remaja putri m"
https://pesona.travel/keajaiban/5454/melihat-pertunjukan-sintren-yang-mistis-dan-sarat-makna,Melihat Pertunjukan Sintren yang Mistis dan Sarat Makna - Pesona Indonesia,"Sintren berasal dari kata “sindir” dan “tetaren” (pertanyaan melalui  syair yang perlu dipikirkan jawabannya). Selain dari kisah perjuangan pemuda-pemuda Cirebon lewat syair-syair penyemangat dalam pagelaran Sintren, kesenian di Cirebon ini juga menampilk"
https://pesona.travel/keajaiban/5390/tongkonan-rumah-adat-toraja-yang-mengagumkan,"Tongkonan, Rumah Adat Toraja yang Mengagumkan - Pesona Indonesia","kita bisamerasakan pengalaman seru, yaitu menginap di rumah Tongkonan. Ini kesempatan yang menarik karena keluarga jarang menempati rumah Tongkonan dan biasanya hanya digunakan untuk menyimpan mayat keluarga dan upacara upacara adat. Ternyata anggapan ang"
https://pesona.travel/keajaiban/5379/istana-maimun-dan-mesjid-raya-medan-peninggalan-sultan-deli,Istana Maimun dan Mesjid Raya Medan Peninggalan Sultan Deli - Pesona Indonesia,"Tak jauh dari Istana Maimun, ada Masjid Raya Medan yang berjarak  hanya 300 meter. Mesjid ini dahulu juga diprakarsai oleh Sultan Makmun Al Rasyid Perkasa Alamsyahdan letaknya menyatu dengan kawasan Istana Maimun.  Namun karena pesatnya perkembangan Kota "
https://pesona.travel/keajaiban/6056/mengapa-museum-nasional-disebut-museum-gajah,Mengapa Museum Nasional Disebut Museum Gajah? - Pesona Indonesia,Museum Nasional merupakan museum pertama dan terbesar yang ada di Asia Tenggara. Eksistensi Museum Nasional diawali dengan berdirinya himpunan Bataviaasch Genootschap van Kunsten en Wetenschappen oleh Pemerintah Belanda pada 24 April 1778.
https://pesona.travel/keajaiban/6051/menelisik-setiap-bagian-benteng-duurstede,Menelisik Setiap Bagian Benteng Duurstede - Pesona Indonesia,"Telah ratusan tahun berlalu, benteng yang luas ini masih terasa kemegahannya. Sampai saat ini, benteng yang sangat strategis karena menghadap tepat ke arah laut dan dilindungi oleh pegunungan ini relatif utuh."
https://pesona.travel/keajaiban/6050/mengenal-9-klan-di-kampung-adat-bena-flores,Mengenal 9 Klan di Kampung Adat Bena Flores - Pesona Indonesia,"Kampung Adat Bena terletak di Pulau Flores, sekitar 18 km dari Kota Bajawa, dihuni sekitar 750 orang yang masih taat pada tradisi asli leluhur. Para penduduk hidup dari bertani dan berkomunikasi satu sama lain dalam bahasa Ngada."
https://pesona.travel/keajaiban/6038/berkunjung-ke-masjid-lasem-dan-makam-para-pendirinya,Berkunjung ke Masjid Lasem dan Makam Para Pendirinya - Pesona Indonesia,"Masjid ini merupakan salah satu cagar budaya yang ada di Jawa Tengah. Lokasi Masjid Jami Lasem terletak di Desa Kauman, Kecamatan Lasem, Kabupaten Rembang."
https://pesona.travel/keajaiban/6036/museum-karst-wonogiri-terbesar-di-asia-tenggara,"Museum Karst Wonogiri, Terbesar di Asia Tenggara - Pesona Indonesia",Terletak di Kawasan Eco-Karst kita bisa melihat secara langsung batuan Karst yang berada diluar museum maupun di dalam museum.
https://pesona.travel/keajaiban/6033/kompleks-candi-gedong-songo-wisata-penuh-sejarah-dan-misteri,Kompleks Candi Gedong Songo Wisata Penuh Sejarah dan Misteri - Pesona Indonesia,"Wilayah Kabupaten Semarang merupakan daerah yang terdiri dari dataran tinggi. Salah satu tempat yang terkenal dan favorit di daerah tersebut adalah Bandungan, di lereng gunung Ungaran. Candi Gedong Songo salah satunya."
https://pesona.travel/keajaiban/6031/benteng-keraton-liya-sisa-kebesaran-kesultanan-buton-di-wakatobi,"Benteng Keraton Liya, Sisa Kebesaran Kesultanan Buton di Wakatobi - Pesona Indonesia","Mendengar kata benteng, yang ada dalam ingatan kita tentu tembok-tembok pertahanan milik pemerintah era kolonial. Namun, apa jadinya jika ada benteng bersejarah yang dibuat oleh kerajaan lokal? Benteng menarik buatan Nusantara ini ada di Wakatobi."
https://pesona.travel/keajaiban/6028/melihat-keunikan-kampung-bajo-mola-wakatobi,Melihat Keunikan Kampung Bajo Mola Wakatobi - Pesona Indonesia,"Sebagai seorang manusia yang hidup di perkotaan, kita mungkin jenuh berkutat dengan rutinitas dan target harian. Bagi yang ingin sejenak kabur dari kepenatan kota dengan merasakan sensasi menjadi suku laut. Pengalaman ini wajib dicoba!"
https://pesona.travel/keajaiban/5956/mangga-gedong-gincu-si-manis-dari-jawa-barat,"Mangga Gedong Gincu, Si Manis dari Jawa Barat - Pesona Indonesia","Selain keindahan alamnya yang tak perlu diragukan lagi, Jawa Barat juga terkenal dengan Mangga Gedong Gincu, buah segar unggulan dengan rasa yang segar."
https://pesona.travel/keajaiban/5567/berburu-kopi-toraja-di-pasar-rantepao,Berburu Kopi Toraja di Pasar Rantepao - Pesona Indonesia,"Dengan harga yang sangat terjangkau, paling mahal Rp50.000 untuk ukuran 500gram, belanja kopi di sini jelas bisa bikin kalap penggemar kopi. Dan benar saja, setelah dibawa pulang dan diseduh air panas, rekomendasi ini jelas berdasar. Kopi Toraja Salu Sopa"
https://pesona.travel/profile-editor-tamu/42/list,Deddy Lisan - Editor Alam - Pesona Indonesia,"Pesona Indonesia menyajikan informasi tentang destinasi wisata, festival mislanya krakatau yang tersebar dari seluruh pelosok nusantara ini untuk Anda dan semua yang akan melakukan perjalanan baik di bulan Agustus atau kapanpun"
https://pesona.travel/keajaiban/5542/catatan-kuliner-balige-tabo-hian,"Catatan Kuliner Balige, Tabo Hian! - Pesona Indonesia","Ukuran duriannya sedang, tidak terlalu besar, tetapi isinya sangat banyak. Rasanya legit, tidak terlalu lembek dan dagingnya tebal. Itu dikarenakan semua durian yang dijual adalah jenis yang masak pohon dan jatuh alami, jadi tidak ada buah durian yang dip"
https://pesona.travel/keajaiban/5538/soto-lama-purwokerto-jagoan-soto-sokaraja,"Soto Lama Purwokerto, Jagoan Soto Sokaraja - Pesona Indonesia","Salah satu gerai yang menyajikan sroto Sokaraja adalah Raja Soto Lama milik Suradi di Jalan Sudirman, Purwokerto. Paling tidak ada 3 gerai Raja Soto Lama. Di gerai ini, boleh pilih daging sapi atau ayam. Kaldu sesuai dengan dagingnya. Artinya, soto ayam p"
https://pesona.travel/keajaiban/5449/wisata-rasa-kuliner-tertua-jakarta-bagian-2,"Wisata Rasa, Kuliner Tertua Jakarta (Bagian 2) - Pesona Indonesia","Nasi Uduk khas Kebon Kacang dibungkus daun pisang berbentuk kerucut dan bagian atasnya ditaburi bawang goreng, ditambah lauk berupa ayam goreng, tahu, tempe goreng, sambal kemiri kental berwarna kemerahan yang rasanya pedas, serta daun kemangi. Kadang-kad"
https://pesona.travel/keajaiban/5842/warung-kopi-legendaris-di-aceh-surga-para-pecinta-kopi,"Warung Kopi Legendaris di Aceh, Surga Para Pecinta Kopi - Pesona Indonesia","Dikenal sebagai penghasil biji kopi terbaik, Aceh sudah punya warung kopi sejak pertengahan tahun 1940-an. Tak salah jika kita menyebutnya warung kopi legendaris."
https://pesona.travel/keajaiban/5841/tergoda-kuliner-khas-majalengka,Tergoda Kuliner Khas Majalengka - Pesona Indonesia,"Berkunjung ke Majalengka tak lengkap rasanya jika tidak mencoba kuliner khasnya. Lezat rasanya, uniknya tiada duanya."
